generos_id,ID,Pais_Origen,lenguage_original,Nombre_Original,Resumen,Popularidad,Fecha_primer_estreno,Nombre,Promedio_voto,Conteo_votos,Critica
18,1396,US,en,Breaking Bad,Un profesor de química con cáncer terminal se asocia con un exalumno suyo para fabricar y vender metanfetamina a fin de que su familia no pase apuros económicos.,123.5705,2008-01-20,Breaking Bad,8.9,17744,Altamente aceptado por la critica
16,209867,JP,ja,葬送のフリーレン,"Décadas después de que su grupo derrotara al Rey Demonio, el funeral de un viejo amigo lleva a la hechicera elfa Frieren a embarcarse en un viaje de autodescubrimiento.",82.4396,2023-09-29,Frieren: Tras finalizar el viaje,8.799,823,Aceptado por la critica
35,64010,KR,ko,응답하라 1988,"Answer Me 1988: Los tiempos pueden haber sido un poco más simples, menos tecnológicos, pero aún así era igual de difícil sobrellevar un día típico en la vida a finales de 1980. Cinco amigos de la infancia, que viven todos en el mismo barrio Ssangmundong de Seúl, se apoyan mutuamente para sobrevivir la compleja adolescencia y forjarse un camino para el futuro. Sung Deok Sol (Hyeri) lucha por atención siendo el hijo del medio en su pobre familia, mientras que también lleva el peso de tener el lugar 989o en la escuela. Kim Jung Hwan (Ryu Joon Yeol) solamente tiene una cosa en mente, el fútbol, ​​incluso después de que su familia se vuelve rica de la noche a la mañana. Sung Woo Sun (Ko Gyung Pyo) es el estudiante perfecto, Presidente del Consejo Estudiantil y un hijo atento y confiable en su familia. Ryu Dong Ryong (Lee Dong Hwi) es un geek que sabe más sobre las niñas y la vida que el resto de sus amigos, pero su mala calificación académica le impide poder ir a la universidad. Choi Taek (Park Bo Gum) es un jugador genio de Go, que dejó la escuela para convertirse en profesional. A medida que el grupo de amigos se mete y sale de travesuras en el barrio, ¿qué experiencias de estos tiempos memorables juntos se van a llevar con ellos a su vida futura?",19.903,2015-11-06,Respuesta 1988,8.779,210,Aceptado por la critica
16,246,US,en,Avatar: The Last Airbender,"La historia transcurre en un mundo de gente principalmente asiática (el estilo de vida en la serie se basa en la primera mitad del siglo XIX), donde predominan las artes marciales y la manipulación de los elementos en combinación con el misticismo oriental, dando seguimiento a las aventuras de Aang, el más reciente sucesor de una larga línea de avatares, y sus amigos en un intento por salvar su místico mundo de la despiadada Nación del Fuego que busca conquistar a las demás naciones. Durante sus travesías son acechados insistentemente por el desterrado príncipe del fuego Zuko, cuyo objetivo es capturar al avatar para recuperar su honor. Esta serie es presentada como si se tratara de una serie de libros, en donde cada episodio actúa como un «capítulo», y cada temporada como un solo «libro», los cuales se titulan por el elemento temático de la temporada.",23.9779,2005-02-21,Avatar: La leyenda de Aang,8.8,4825,Aceptado por la critica
16,94605,US,en,Arcane,"Con las dispares ciudades de Piltover y Zaun como telón de fondo, dos hermanas luchan en bandos opuestos de una guerra entre tecnologías mágicas y creencias enfrentadas.",38.192,2021-11-06,Arcane,8.754,5882,Aceptado por la critica
18,250307,US,en,The Pitt,"The Pitt ofrece una visión realista de los retos a los que se enfrenta el personal sanitario en los Estados Unidos de hoy, visto a través de la lente de los héroes de primera línea que trabajan en un hospital de la actualidad en Pittsburgh, Pensilvania.",58.6526,2025-01-09,The Pitt,8.737,741,Aceptado por la critica
10759,37854,JP,ja,ワンピース,"Esta historia se sitúa en el momento más álgido de la Gran Era de los Piratas, cuando el joven Monkey D. Luffy quiere llegar a ser el Rey de los Piratas y hacerse al fin con un legendario tesoro, el One Piece.",61.892,1999-10-20,One Piece,8.7,5297,Aceptado por la critica
18,301507,CA,en,Heated Rivalry,"Dos de las mayores estrellas de la Major League Hockey están unidas por la ambición, la rivalidad y una atracción magnética que ninguna de las dos comprende del todo. Lo que comienza como una aventura secreta entre dos novatos se convierte en un viaje de años de amor, negación y autodescubrimiento. Durante los siguientes ocho años, mientras buscan la gloria sobre el hielo, luchan por comprender sus sentimientos mutuos. Divididos entre el deporte que les apasiona y el amor que no pueden ignorar, deben decidir si hay espacio en su mundo ferozmente competitivo para algo tan frágil —y poderoso— como el amor verdadero.",25.4213,2025-11-28,Más que rivales,8.727,467,Aceptado por la critica
18,219246,KR,ko,폭싹 속았수다,"En la isla de Jeju, una chica llena de vida y un joven decidido viven una historia repleta de desafíos y triunfos que demuestra que el amor puede trascender el tiempo.",30.6521,2025-03-07,Si la vida te da mandarinas...,8.716,522,Aceptado por la critica
10759,85077,US,en,The Chosen,"Por primera vez, la historia más grande jamás contada se presenta en una serie de varias temporadas. Enfocada en los personajes y el contexto histórico de los Evangelios, la primera temporada del mayor proyecto audiovisual producido mediante crowdfunding nos muestra a personas como Pedro, Nicodemo, María Magdalena, Mateo y, por supuesto, Jesús, de una manera nunca vista antes en pantalla. La serie muestra la parte más auténtica e íntima de la vida y el ministerio de una de las figuras más importantes e influyentes de la Historia de la humanidad.",43.5792,2019-04-21,The Chosen (Los elegidos),8.713,855,Aceptado por la critica
18,87108,US,en,Chernobyl,"En Abril de 1986, la Central Nuclear de Chernóbil en Ucrania (en aquel entonces, la Unión Soviética), sufrió una explosión masiva que liberó material radioactivo en Bielorrusia, Rusia, Ucrania, así como en zonas de Escandinavia y Europa Central. La serie relata lo que aconteció en 1986, en uno de los mayores desastres provocados por el hombre en la historia reciente, así como los sacrificios realizados para salvar al continente de un desastre sin precedentes.",33.7681,2019-05-06,Chernobyl,8.709,7850,Aceptado por la critica
80,60059,US,en,Better Call Saul,"Esta precuela de ""Breaking Bad"" nominada al Emmy narra la vida del picapleitos Jimmy McGill y su transformación en Saul Goodman, el abogado de moral laxa.",81.9212,2015-02-08,Better Call Saul,8.705,6467,Aceptado por la critica
16,31911,JP,ja,鋼の錬金術師 FULLMETAL ALCHEMIST,"Remake de Fullmetal Alchemist. Edward y Alphonse rompieron la regla basica de la alquimia, la cual les trajo graves consecuencias. Para remediar esto, se embarcan en busca de alguna forma de solucionar sus males",57.3417,2009-04-05,Fullmetal Alchemist: Brotherhood,8.705,2443,Aceptado por la critica
16,1429,JP,ja,進撃の巨人,"Tras un siglo de aparente paz, un titán colosal rompe las murallas que protegían a la humanidad, desatando una nueva masacre. Eren Jaeger y el Cuerpo de Exploradores lucharán para recuperar su mundo y enfrentar la amenaza titán.",37.2429,2013-04-07,Ataque a los Titanes,8.7,7404,Aceptado por la critica
16,60625,US,en,Rick and Morty,"Comedia animada que narra las aventuras de un científico loco Rick Sánchez, que regresa después de 20 años para vivir con su hija, su marido y sus hijos Morty y Summer.",79.584,2013-12-02,Rick y Morty,8.7,10843,Aceptado por la critica
80,1398,US,en,The Sopranos,"Los Soprano (The Sopranos) es una serie de televisión estadounidense creada y producida por David Chase. La serie se estrenó en Estados Unidos el 10 de enero de 1999 por el canal de televisión por cable HBO, que la emitió ininterrumpidamente hasta su desenlace, el 10 de junio de 2007. La trama de la serie gira en torno al mafioso de Nueva Jersey Tony Soprano (James Gandolfini) y las dificultades que enfrenta tanto en su hogar como en la organización criminal que dirige. A su vez, la serie también se centra en la historia de los personajes cercanos a Tony, especialmente su esposa Carmela (Edie Falco) y su sobrino y protegido Christopher Moltisanti (Michael Imperioli).",91.4186,1999-01-10,Los Soprano,8.7,3443,Aceptado por la critica
16,46298,JP,ja,HUNTER×HUNTER,"Gon Frecks, un niño de 12 años, vive con su tía Mito y su abuela en Isla Ballena, huérfano de madre y según su tía también de padre. Un día Gon es atacado por un oso del bosque, pero es salvado por un cazador quien le explica que está en busca de su maestro para así convertirse en un cazador, él es quien le dice que su padre Gin está vivo. Enterado de esto Gon decide convertirse en cazador para poder encontrar a su padre.",65.8485,2011-10-02,Hunter × Hunter,8.667,2088,Aceptado por la critica
10759,200709,KR,ko,약한영웅,"Yeon Shi Eun, un estudiante modelo con calificaciones que pertenecen al 1% superior de la escuela. Se ve débil pero lucha contra numerosas violencias dentro y fuera de la escuela. Representa a un chico naturalmente débil en términos de apariencia, dominando una escuela parecida a una jungla usando su cerebro, poder analítico y herramientas.",68.5983,2022-11-18,Un héroe débil,8.7,419,Aceptado por la critica
16,92685,US,en,The Owl House,"Luz, una adolescente humana muy segura de sí misma, tropieza con un portal a un nuevo mundo mágico donde se hace amiga de una bruja rebelde, Eda, y de un adorable y diminuto guerrero, Rey. A pesar de no saber hacer magia, Luz persigue su sueño de convertirse en bruja aprendiendo de Eda en la Casa Búho, y acaba por encontrar una nueva familia en un entorno extraño.",29.5766,2020-01-10,Casa Búho,8.664,1784,Aceptado por la critica
16,42573,JP,ja,スラムダンク,"Slam Dunk trata sobre la vida de Hanamichi Sakuragi, un pandillero que se convierte en un gran jugador de baloncesto, sólo para tratar de ligar con una chica de su escuela.",16.0741,1993-10-16,Slam Dunk,8.663,963,Aceptado por la critica
16,271607,JP,ja,薫る花は凛と咲く,"Cuando el imponente Rintaro conoce a la abierta y curiosa Kaoruko, surge entre ellos una inesperada amistad. Pero hay un problema: sus institutos se odian a muerte.",21.6933,2025-07-06,La nobleza de las flores,8.667,201,Aceptado por la critica
18,234763,RU,ru,Слово пацана. Кровь на асфальте,,5.7709,2023-11-09,Слово пацана. Кровь на асфальте,8.647,211,Aceptado por la critica
18,70785,CA,en,Anne with an E,"Anne Shirley es una niña huérfana que vive en un pequeño pueblo llamado Avonlea que pertenece a la Isla del Príncipe Eduardo, en el año 1890. Después de una infancia difícil, donde fue pasando de orfanato a hogares de acogida, es enviada por error a vivir con una solterona y su hermano. Cuando cumple 13 años, Anne va a conseguir transformar su vida y el pequeño pueblo donde vive gracias a su fuerte personalidad, intelecto e imaginación.",18.6005,2017-03-19,Anne with an E,8.651,4922,Aceptado por la critica
16,131378,US,en,Adventure Time: Fionna and Cake,"Fionna y Cake, con la ayuda del anterior Rey del Hielo, se embarcan en una aventura multiversal y en un viaje de autodescubrimiento.",22.2653,2023-08-31,Hora de aventuras: Fionna y Cake,8.649,319,Aceptado por la critica
16,42705,JP,ja,はじめの一歩,"""Hajime no Ippo"" sigue a Makunouchi Ippo, un joven de 17 años que, cansado de ser considerado débil, entra al mundo del boxeo inspirado por Mamoru Takamura, un reconocido boxeador profesional en Japón.",39.1093,2000-10-03,Espíritu de lucha: Hajime no Ippo,8.6,1188,Aceptado por la critica
10759,89456,US,en,Primal,Un hombre de las cavernas forma un vínculo con un dinosaurio mientras luchan por sobrevivir en un mundo hostil.,13.5349,2019-10-08,Primal,8.646,1563,Aceptado por la critica
18,280945,KR,ko,폭군의 셰프,"Una chef de talento viaja en el tiempo y conoce a un rey tiránico. Con sus platos modernos, logra cautivar su paladar, pero le esperan desafíos muy reales.",13.7913,2025-08-23,"Bon appétit, majestad",8.645,236,Aceptado por la critica
16,127532,JP,ja,俺だけレベルアップな件,"Lo que no te mata te hace más fuerte, pero en el caso de Sung Jinwoo, lo que lo mató lo hizo más fuerte. Después de ser brutalmente asesinado por monstruos en una mazmorra de alto rango, Jinwoo regresó con el Sistema, un programa que solo él puede ver y que eleva su nivel en todos los sentidos. Ahora, está decidido a descubrir los secretos detrás de sus poderes y la mazmorra que los engendró.",55.7998,2024-01-07,Solo Leveling,8.637,1712,Aceptado por la critica
99,1430,US,en,Cosmos: A Personal Voyage,"Tras el enorme éxito mundial de su libro ""Cosmos"", el carismático astrónomo y divulgador científico norteamericano Carl Sagan (1934-1996) lleva sus teorías y explicaciones sobre el conocimiento del Universo a la pequeña pantalla en esta aclamada serie que intenta responder a las grandes preguntas del Cosmos y la vida. Entre los temas que se abordan en los diferentes capítulos están los orígenes de la vida, la búsqueda de vida en Marte, la composición de las estrellas y las galaxias, los viajes interestelares, los efectos de la velocidad de la luz, los peligros de la destrucción de la Tierra por la tecnología humana y la búsqueda de vida extraterrestre, entre otros muchos temas. ",5.721,1980-09-28,Cosmos: Un viaje personal,8.635,430,Aceptado por la critica
16,95557,US,en,INVINCIBLE,"Mark Grayson es un adolescente normal, excepto por el hecho de que su padre es el superhéroe más poderoso del planeta. Poco después de su decimoséptimo cumpleaños, Mark comienza a desarrollar sus propios poderes y entra en la tutela de su padre.",99.407,2021-03-25,INVENCIBLE,8.6,5768,Aceptado por la critica
99,68595,GB,en,Planet Earth II,"La segunda parte del mítico documental ""Planeta Tierra"", nos sumerge en increíbles paisajes y nos permite experimentar el mundo a través de la perspectiva de los animales. Viajando a través de junglas, desiertos, montañas, islas, dehesas y ciudades, esta serie documental explora las características de los habitantes más icónicos de la tierra y sus extraordinarios modos de supervivencia. La nueva tecnología nos acerca a detalles sin precedentes en la vida de los animales.

Hace una década, ""Planeta Tierra"" redefinió la forma de hacer documentales de naturaleza, regalándonos el retrato más completo de la vida en la tierra. En esta ocasión, los revolucionarios equipos y profesionales de BBC Earth han tratado de hacernos experimentar el mundo desde el punto de vista de los propios animales. A través de junglas, desiertos, montañas, islas, llanuras y ciudades, ""Planet Eath II"" explora de una manera única los hábitats naturales más icónicos del mundo.",6.8932,2016-11-06,Planeta Tierra II,8.634,922,Aceptado por la critica
16,31132,US,en,Regular Show,Mordecai y Rigby son dos amigos inseparables que convierten en fantasía los problemas y tareas cotidianas de sus aburridos trabajos.,70.03,2010-09-06,Historias corrientes,8.634,2240,Aceptado por la critica
16,85937,JP,ja,鬼滅の刃,"Tanjiro Kamado vive feliz con su madre y hermanos pequeños en la montaña, subsistiendo humildemente. Una mañana, al regresar a casa, se encuentra a toda su familia asesinada y a su hermana Nezuko convertida en demonio. Tanjiro buscará desesperadamente la manera de devolverla a su condición humana y de cobrarse venganza. Para ello, se someterá a un arduo entrenamiento, con el objetivo de ingresar en el Cuerpo de Matademonios y dar caza al demonio Muzan Kibutsuji, con la ayuda de Nezuko, que se resiste a perder del todo su humanidad. Juntos forman la nueva hornada de los guardianes de la noche.",21.75,2019-04-06,Kimetsu no Yaiba: Guardianes de la Noche,8.633,7212,Aceptado por la critica
35,72637,AR,es,O11CE,"La serie gira en torno a Gabo, un adolescente amante del fútbol que, al recibir una beca del prestigioso Instituto Académico Deportivo (IAD) de Buenos Aires, verá cumplido su sueño de jugar en Los Halcones Dorados, el reconocido equipo amateur del colegio, y también su anhelo de convertirse en futbolista profesional.",17.2127,2017-06-19,O11CE,8.632,1523,Aceptado por la critica
16,62741,JP,ja,神様はじめました,"La historia comienza con Nanami Momozono, una chica que ha perdido su  casa a causa de las deudas de juego de su padre y ha sido abandonada por  éste. Al encontrarse en el parque sin casa o lugar adónde ir, conoce a  un joven y lo ""salva"" ya que estaba siendo amenazado por un perro, a  cambio de dicho acto el joven le concede su propiedad y el derecho de  ser el ""nuevo"" dios de la tierra.",11.8349,2012-10-02,Kamisama Hajimemashita,8.628,1007,Aceptado por la critica
80,1438,US,en,The Wire,"David Simon, creador y coguionista de la miniserie de HBO tres veces ganadora del premio Emmy The Corner, este sencillo y extremadamente realista drama sigue una caótica y controvertida investigación de drogas y asesinatos en Baltimore que conllevará peligrosos pinchazos telefónicos y continua vigilancia. Mostrando ambas perspectivas, de la policía y de sus criminales, la serie captura un universo donde distinguir entre el bien y el mal, el delito y la condena, es siempre desafío.",50.5764,2002-06-02,Bajo escucha,8.628,2659,Aceptado por la critica
35,3498,US,en,Wizards of Waverly Place,"La familia Russo es como cualquier otra familia de Manhattan, aunque con una pequeña diferencia: descienden de una ancestral familia de magos. El padre procede de una ancestral familia con poderes mágicos, a los cuales renunció para casarse con su mujer. Sin embargo, sus tres hijos (Justin, Alex y Max) parecen haber heredado parte de esa magia. Eso sí: los tres jovencitos deberán aprender a controlar los poderes que acaban de descubrir si no quieren perderlos para siempre.",19.2373,2007-10-12,Los magos de Waverly Place,8.627,1167,Aceptado por la critica
16,13916,JP,ja,DEATH NOTE,"Light Yagami, un estudiante japonés, encuentra un cuaderno llamado Death Note que permite matar a cualquier persona cuyo nombre se escriba en él. Usando este poder, decide crear un mundo ""perfecto"" eliminando a los criminales. Sin embargo, su plan empieza a torcerse cuando L, un brillante detective, intenta descifrar el misterio que rodea a todas estas muertes.",36.9853,2006-10-04,Death Note,8.625,4896,Aceptado por la critica
99,1044,GB,en,Planet Earth,"'Planeta Tierra' es una serie de televisión estrenada en 2006 y producida por la Sección de Historia Natural de la BBC. Ganadora de un premio Emmy, esta serie tardó alrededor de cinco años en ser realizada por completo. Fue, además, el documental de naturaleza más caro jamás producido por la BBC, y fue descrito por sus creadores como ""la mirada definitiva a la diversidad de nuestro planeta"".",13.5934,2006-03-05,Planeta Tierra,8.621,1237,Aceptado por la critica
99,74313,GB,en,Blue Planet II,"Siguiendo la estela de Planeta Azul estrenado en 2001, BBC Earth nos presenta un increíble y actualizado retrato del desconocido mundo marino, justo cuando se hace esencial tomar consciencia del momento crítico de los ecosistemas oceánicos. A lo largo de 4 años de producción se han realizado más de 125 expediciones en 39 países. Los equipos de grabación pasaron más de 1.500 días en el mar grabando en todo tipo de hábitats: desde nuestras cercanas costas hasta las misteriosas profundidades abisales, desde los atestados arrecifes de coral a los inhóspitos desiertos submarinos.

Planeta Azul II cuenta con Sir David Attenborough como narrador y la banda sonora de la serie ha sido compuesta por el ganador de un Oscar, Hans Zimmer. Además la banda británica Radiohead ha colaborado con el compositor alemán con una nueva versión de su canción Bloom.",4.1059,2017-10-29,Planeta Azul 2,8.619,337,Aceptado por la critica
10759,3854,US,en,The Spectacular Spider-Man,"La serie presenta a Peter Parker como un estudiante de preparatoria que en meses recientes ha adquirido los poderes y la identidad de Spider-Man.  Sus mejores amigos son Harry Osborn y Gwen Stacy, y mas adelante conoce a Mary Jane Watson.

Obtiene su primer empleo en el diario ""Daily Bugle"" dirigido por J. Jonah Jameson, e intenta conseguir algo de dinero para ayudar a su tia May.

Mientras debe lidiar con los problemas tipicos de todo adolecente y combatir el crimen en la Ciudad de New York.",11.6038,2008-03-08,El Espectacular Spiderman,8.6,899,Aceptado por la critica
35,57706,JP,ja,らんま1/2,"Ranma Saotome, un joven artista marcial de 16 años, sufre una maldición que lo convierte en mujer con el agua fría y en hombre con el agua caliente. Mientras busca una cura, debe afrontar su compromiso arreglado con Akane Tendo.",47.1786,1989-04-15,Ranma ½,8.614,1509,Aceptado por la critica
10759,65930,JP,ja,僕のヒーローアカデミア,"Las personas no nacen igual. El protagonista de esta historia es uno de esos casos raros que nacen sin superpoderes, pero esto no le impedirá perseguir su sueño: ser un gran héroe como el legendario All-Might. Para convertirse en el héroe que quiere ser, se apuntará a una de las academias de héroes más prestigiosas del país: Yueiko. Con la ayuda de su ídolo, All-Might, ¿podrá convertirse en un verdadero héroe?",19.6849,2016-04-03,My Hero Academia,8.614,5270,Aceptado por la critica
10764,77696,KR,ko,달려라 방탄!,,11.6788,2015-08-01,Corre BTS (Run BTS),8.612,374,Aceptado por la critica
16,60863,JP,ja,ハイキュー!!,"Un hecho fortuito desencadena el amor de Shouyou Hinata por el voleibol. Su club no tenía ningún miembro, pero de algún modo perseveró y finalmente realizó su primer y último partido regular de la escuela secundaria, donde fue aniquilado por Tobio Kageyama, un jugador superestrella conocido como ""Rey de la Corte."" ¡Jurando venganza, Hinata ingresa en el club de voleibol Karasuno, de secundaria alta, solo para volver a encontrarse cara a cara con su odiado rival, Kageyama!",38.4012,2014-04-06,Haikyuu!! Los ases del vóley,8.6,1494,Aceptado por la critica
16,40075,US,en,Gravity Falls,"Narra las aventuras de los mellizos de 12 años Dipper y Mabel Pines, que ven cómo se desvanecen sus planes para el verano cuando sus padres deciden mandarlos con su tío-abuelo Grunkle Stan, que vive en el corazón de Gravity Falls. Pronto, Dipper y Mabel descubren que en Gravity Falls no todo es lo que parece y confían el uno en el otro y en sus nuevos amigos para descubrir lo que REALMENTE está sucediendo en este extraño lugar...",33.7722,2012-06-15,Gravity Falls,8.6,3457,Aceptado por la critica
16,100,GB,en,I Am Not an Animal,"I Am Not An Animal es una serie de comedia animada sobre los únicos seis animales que hablan en el mundo, cuya existencia en una unidad de vivisección se pone patas arriba cuando son liberados por activistas de los derechos de los animales.",2.5043,2004-05-10,I Am Not an Animal,8.611,786,Aceptado por la critica
18,67915,KR,ko,쓸쓸하고 찬란하神-도깨비,"Un ser inmortal desea terminar su existencia buscando en todo el mundo su novia que es la destinada a sacar la espada que le atraviesa el pecho y solo ella es capaz de verla, pero luego de conocerse se enamoran y  es cuando todo cambia para el ser inmortal ya que debido al amor que siente encuentra una nueva razón para mantenerse vivo pero con esto pone en peligro a su amada que además es capaz de ver fantasmas, paralelamente existe un ángel de la muerte que se enamora perdidamente de la que resulta ser la reencarnación de la hermana del ser inmortal. Durante el desarrollo de esta serie se pueden disfrutar de momentos que evocan emisiones inimaginable y definitivamente no tiene ni un solo instante desperdiciado.",17.4802,2016-12-02,GOBLIN: El solitario ser inmortal,8.604,3066,Aceptado por la critica
16,95269,JP,ja,地縛少年花子くん,"Yashiro Nene busca ayuda fantasmal con su vida amorosa, pero cuando ""Hanako-san"", el espíritu que concede deseos que acecha en el baño de las niñas, resulta ser un niño, puede terminar recibiendo más o menos de lo que esperaba.",18.3024,2020-01-10,Jibaku Shounen Hanako-kun,8.6,773,Aceptado por la critica
16,35790,JP,ja,カードキャプターさくら,"La obra narra las aventuras de Sakura Kinomoto, una pequeña niña de diez años que accidentalmente libera un conjunto de cartas que se encontraban dentro de un libro, el cual había descubierto en la biblioteca de su padre. Tras esto, Kero —el guardián del libro— emerge y, al enterarse de que la mayoría de las cartas conocidas como las «cartas Clow» se habían esparcido por todas partes, le dice a Sakura que ahora es su responsabilidad convertirse en una «cardcaptor» e ir en busca de ellas para evitar que ocurra una «catástrofe» en el mundo. Por lo tanto, Sakura adquiere habilidades especiales para así enfrentarse a los poderes mágicos de cada carta y lograr capturarlas y sellarlas. Kero se vuelve el guía y mentor de Sakura durante la búsqueda, mientras que su mejor amiga, Tomoyo Daidōji, le confecciona gran variedades de trajes, ya que según ella «debe llevar una ropa especial para una ocasión especial». Además, Tomoyo suele hacer grabaciones de las batallas de Sakura.",17.4396,1998-04-07,"Sakura, cazadora de cartas",8.597,790,Aceptado por la critica
35,43,CL,es,31 Minutos,"El programa se centra en las aventuras del equipo de un noticiero de poco prestigio, donde siempre ocurre algo inesperado. Sus notas, mientras algunas son bastante ridículas, otras son educativas y dejan un mensaje tanto explícita como implícitamente. El noticiario es conducido por Tulio Triviño.",2.9625,2003-03-15,31 Minutos,8.596,376,Aceptado por la critica
