generos_id,ID,Pais_Origen,lenguage_original,Nombre_Original,Resumen,Popularidad,Fecha_primer_estreno,Nombre,Promedio_voto,Conteo_votos,Critica
16,80040,ES,es,Desafío Champions Sendokai,"Zak, Cloe, Kiet y Fenzy son cuatro chicos de la Tierra poco populares y sin ningún talento para el deporte. Un día encuentran unos brazaletes que los transportan a otra dimensión. Allí conocen al maestro Tänpo, que les explica que el imperio de los Zorn está conquistando todas las dimensiones del Multiverso. La Tierra está en peligro y, si quieren salvarla, sólo habrá una manera: tendrán que superar sus debilidades, aprender el arte del Sendokai hasta convertirse en guerreros y ganar el Gran Torneo del Multiverso.",2.9712,2013-04-09,Desafío Champions Sendokai,8.594,234,Aceptado por la critica
35,21650,US,en,I'm in the Band,"Tripp Campbell un chico de 15 años sueña con poder demostrar su habilidad con la guitarra y formar parte de una banda de rock. Su vida cambia cuando gana un concurso de radio para disfrutar de una cena con su banda favorita de rock: “Iron Weasel” una banda de rock con un pasado glorioso y un presente muy poco prometedor. Pero para él es un sueño hecho realidad. Tripp Campbell se unirá a esta banda e intentará que vuelvan a los escenarios como en su reputado pasado. Sin duda esa será su misión aunque para ello tenga que lidiar con un trío de estrellas de rock venidas a menos que ni siquiera pueden pagar su propia vivienda y se instalan en la habitación de invitados de casa de Tripp. Sin embargo, a su estilo, estos tres nuevos “compañeros” harán todo lo posible por ayudar a Tripp a abrirse paso en su etapa de adolescente con el objetivo de convertirlo en una auténtica estrella de rock y darle la oportunidad de hacer realidad su sueño.",4.5284,2009-11-27,Esta es mi banda,8.593,274,Aceptado por la critica
16,94954,US,en,Hazbin Hotel,"Charlie Lucero del Alba, la princesa del Infierno, intenta convencer a los demonios y a los ángeles de que toda alma es redimible. Una comedia musical para adultos sobre las segundas oportunidades repleta de canciones y tacos.",29.652,2024-01-18,Hazbin Hotel,8.592,1556,Aceptado por la critica
16,79141,CN,zh,刺客伍六七,Este aprendiz de sicario empuña de noche sus tijeras de peluquero para ganar dinero y recordar su pasado mientras lidia con unos compañeros poco amistosos.,26.4461,2018-04-25,Scissor Seven,8.6,769,Aceptado por la critica
35,62914,ES,ca,Merlí,"Merlí es un profesor de una materia denostada y apreciada a partes iguales, filosofía. Un tipo contradictorio, y con virtudes y defectos a la par. La producción se centra en la relación del maestro con sus alumnos y, sobre todo, en «los conflictos entre padres e hijos, estudiantes y profesores...»",5.6573,2015-09-14,Merlí,8.599,1169,Aceptado por la critica
35,2316,US,en,The Office,"Steve Carell protagoniza The Office, un fresco y divertido vistazo, con formato pseudo-documental, al día a día en la vida de unos excéntricos trabajadores de la empresa Dunder Mifflin. El serio pero despistadísimo director Michael Scott se considera un magnífico jefe y mentor, pero realmente inspira más críticas que respeto a sus empleados.",100.4688,2005-03-24,The Office,8.59,5172,Aceptado por la critica
16,220542,JP,ja,薬屋のひとりごと,"Maomao llevaba una vida tranquila ayudando a su padre, un boticario. Todo cambia el día que la venden como sirvienta al palacio del emperador, pero la vida entre nobles y realeza no es para ella. Cuando la familia imperial enferma, ella decide intervenir para encontrar una cura, lo que llama la atención de Jinshi, un guapo oficial de palacio que decide ascenderla como dama de compañía de una de las concubinas del emperador. ¡Su habilidad con la medicina la hará conocida en el palacio por ayudar a resolver muchos misterios!",117.4732,2023-10-22,Los diarios de la boticaria,8.6,560,Aceptado por la critica
10759,37419,JP,ja,ゾイド,"La historia se inicia en el planeta Zi, un planeta habitado por grandes compañeros mecánicos conocidos como ""zoids"" que han sido modificados por los humanos para ser utilizados como armas de guerra .

En este planeta, dos naciones que antiguamente se encontraban enemistadas, la República de Helic y el Imperio de Guylos, se encuentran a comienzos de una nueva guerra, luego de ser descubierta una antigua tecnología que puede favorecer a ambos ejércitos.

En ese momento, un joven aventurero llamado Van Freiheit, que sueña con ser piloto de zoids, encuentra en unas antiguas ruinas un organoide a quien llama Zeek, el que luego reaviva a Shield Liger, un zoid de combate que Van conducirá para luchar. Más tarde, en las mismas ruinas encuentra a una niña, a quien llama Fine. Debido a que ella ha perdido su memoria, los tres parten de viaje en búsqueda de su pasado. Durante su camino conocen a dos importantes compañeros y amigos, Moonbay, una transportista de cargas e Irvine, un caza recompensas.

Mientras tanto, Proitzen, el general en jefe del ejército imperial, quiere comenzar una nueva guerra que acabe con la nación republicana. Primero intenta asesinar a Rudolph, el legítimo sucesor de la corona de Guylos, transformándose luego en el regente del imperio.

Van y sus compañeros se involucran en esta guerra y detienen la ambición de Proitzen. Luego ambas naciones hacen las paces.

Dos años más tarde, Van, quien ya se encuentra convertido en un destacado piloto zoid, y Fine pasan a formar parte de la Fuerza Guardián, un equipo encargado de mantener la paz, y que está conformado por miembros tanto por la nación republicana como la imperial. Dentro de este grupo conocen a un nuevo compañero, Thomas Schwarz, un experto en computadoras que lucha utilizando su Dibison.

La Fuerza Guardián se formó debido a que extraños atentados comienzan a ocurrir en ambas naciones. El principal sospechoso es un hombre llamado Hiltz, quien luego de varios ataques contra las naciones, logra apoderarse del Death Saurer y poner en peligro la humanidad, pero Van y sus aliados se encargan de detenerlo.",8.0201,1999-09-04,Zoids,8.586,365,Aceptado por la critica
10765,46896,US,en,The Originals,"Spin off de 'Crónicas vampíricas'. Se concentrará sobre Klaus y los originales de 'Crónicas vampíricas' (después o antes de Elijah). Le veremos regresar al Nuevo Orleans y se reencontrará allí a su diabólico y antiguo protegido Marcel. Phoebe Tonkin, que da vida a la mujer lobo Hayley en la temporada 4 de 'Crónicas vampíricas', también estará presente en el reparto de este potencial spin off que será escrito por Julie Plec, cocreadora de 'Crónicas vampíricas'. La trama contará con Camille, una estudiante de psicología que despertará el interés de Klaus. A pesar de ser humana, el personaje tendrá su lado sombrío y quedará intrigada con el híbrido.",40.3587,2013-10-03,Los originales,8.584,3576,Aceptado por la critica
18,4613,US,en,Band of Brothers,"Miniserie de TV de 10 episodios que se basa en el bestseller de Stephen E. Ambrose ""Band Of Brothers"". Narra la historia de la Easy Company, un batallón americano del regimiento 506 de paracaidistas que luchó en Europa durante la II Guerra Mundial (1939-1945). Incluye entrevistas a los supervivientes, recuerdos de los periodistas y cartas de los soldados.",28.2661,2001-09-09,Hermanos de sangre,8.584,4155,Aceptado por la critica
18,119464,KR,ko,나빌레라,Un septuagenario y un veinteañero excepcionalmente talentoso se ayudan a superar sus duras realidades y asumen el reto de convertirse en bailarines.,5.8495,2021-03-22,Navillera,8.6,204,Aceptado por la critica
16,82728,AU,en,Bluey,"Bluey es una perrita de seis años incansable. Esta pastor ganadero australiano azul convierte el día a día con su familia en una aventura extraordinaria y desarrolla así tanto su imaginación como su capacidad mental, física y emocional.",37.4051,2018-10-01,Bluey,8.58,687,Aceptado por la critica
16,35610,JP,ja,犬夜叉,"InuYasha es el nombre de un demonio que en su día sellaron para que no provocara más problemas. Pero Kagome, fruto del destino, consigue atravesar la barrera mágica que separa el mundo actual con el de las guerras civiles, y quita el sello a Inu Yasha debido a la amenaza de cierto monstruo. Kagome posee la joya de las cuatro almas, que permite ganar gran poder, y ella será fruto del recelo de muchos monstruos en busca de ella. Pero la joya se ha roto en mil y un pedazos, e Inu Yasha y Kagome partirán en busca de todos los trozos de la joya.",30.1359,2000-10-16,InuYasha,8.579,2068,Aceptado por la critica
10759,2098,US,en,Batman: The Animated Series,"Bruce Wayne de día, Batman de noche. Junto a su inseparable aprendiz, Robin, Batman luchará por la estabilidad y bienestar de los habitantes de Gotham; protegiendo a la ciudad de villanos como Dos Caras, Joker, Harley Quinn y Pingüino.",38.0461,1992-09-05,Batman: La Serie Animada,8.576,1818,Aceptado por la critica
16,98214,MX,es,Villanos,"Villanos es la historia de Black Hat Org., dirigida por Black Hat (cuyo nombre es un sinonimo de villano, una referencia a los vaqueros malvados con sombrero negro de las películas occidentales) y su equipo de tres ayudantes menos villanos. Black Hat está tratando de vender varios inventos malvados creados por el Dr. Flug y está desesperado por lograr sus aspiraciones malvadas. Sin embargo, las cosas suelen terminar mal para él, ya que las brillantes innovaciones tienden a tener pequeños y a menudo cómicos defectos.",2.3032,2017-05-15,Villanos,8.574,303,Aceptado por la critica
35,31356,US,en,Big Time Rush,"Cuatro jugadores de hockey de Minnesota aspiran a convertirse en una banda de chicos. Kendall, Logan, Carlos y James se embarcan en un viaje que les cambia la vida y se enfrentan a desafíos en el camino.",12.1022,2009-11-28,Big Time Rush,8.573,1679,Aceptado por la critica
35,97186,US,en,"Love, Victor","Basada en la novela para jóvenes de Becky Albertalli 'Simon vs. the Homo Sapiens Agenda', que inspiró el largometraje 'Love, Simon'. 'Love, Victor' sigue a Victor, un nuevo estudiante de Creekwood High School en su autodescubrimiento, enfrentándose a problemas en casa, adaptándose a una nueva ciudad y descubriendo su orientación sexual. Cuando todo se le está haciendo difícil, se acerca a Simon para que le ayude a lidiar con los altibajos de su vida.",10.165,2020-06-17,"Con amor, Victor",8.569,1641,Aceptado por la critica
16,80564,JP,ja,BANANA FISH,"La naturaleza hizo a Ash Lynx un hombre hermoso al que convirtieron en un asesino despiadado y frío. Era un niño fugitivo criado como el heredero adoptado, el ejecutor y juguete sexual de “Papa” Dino Golzine, el señor del crimen de la Costa Este. Sin embargo, cuando Ash cumple los diecisiete años, decide huir de este reino de poder y riquezas para unirse a una banda de matones callejeros. En ese momento conocerá a Eiji Okamura, un joven e inocente fotógrafo llegado desde Japón que caerá en la espiral de orgullo, lujuria, ira y orgullo provocada por el nombre en clave “Banana Fish”.",17.1562,2018-07-06,Banana Fish,8.6,915,Aceptado por la critica
10765,890,JP,ja,新世紀エヴァンゲリオン,"En 2015, tras el catastrófico ""Segundo Impacto"" que devastó la Tierra, los ""Ángeles"" regresan para atacar. La organización NERV crea los Evas, robots bio-mecánicos pilotados por jóvenes como Shinji, Rei y Asuka, los únicos capaces de enfrentarlos. Mientras luchan, descubren oscuros secretos sobre la humanidad y su destino.",35.5765,1995-10-04,Neon Genesis Evangelion,8.571,2069,Aceptado por la critica
10759,66732,US,en,Stranger Things,"A raíz de la desaparición de un niño, un pueblo desvela un misterio relacionado con experimentos secretos, fuerzas sobrenaturales aterradoras y una niña muy extraña.",134.6631,2016-07-15,Stranger Things,8.567,21175,Aceptado por la critica
18,1408,US,en,House,"House M. D. es un drama médico Estadounidense que se emitió originalmente por la cadena Fox durante ocho temporadas, desde el 16 de noviembre de 2004 al 21 de mayo de 2012. El protagonista de la serie es el Dr. Gregory House, un médico nada convencional, genio, misántropo y adicto a las drogas que dirige un equipo de diagnósticos en el ""Princeton-Plainsboro Teaching Hospital"" (nombre ficticio) en Nueva Jersey.",144.0991,2004-11-16,House,8.567,7563,Aceptado por la critica
9648,61617,US,en,Over the Garden Wall,"Los hermanos Wirt y Greg, se encuentran perdidos en Lo Desconocido: un bosque misterioso a la deriva en el tiempo. Con la ayuda de un sombrío leñador y una pájaro azul de nombre Beatriz, Wirt y Greg deben viajar a través de este extraño lugar con la esperanza de regresar a casa.

Más allá del jardín (título original en inglés: Over the Garden Wall) es una miniserie animada estadounidense de 10 episodios, creada por Patrick McHale, y transmitida en Cartoon Network. El show está basado en un cortometraje del mismo McHale titulado como Tome of the unknown, que fue producido como parte de los cortos para programas en desarrollo de Cartoon Network Studios. McHale concibió la idea para esta serie en 2004, y la propuso para la cadena en 2006. Después de trabajar en Las maravillosas desventuras de Flapjack y Hora de aventura, la cadena le expresó su interés a McHale y crearon un piloto, el cual se convirtió en el catalizador para Más allá del jardín.",9.2778,2014-11-03,Más allá del jardín,8.566,1744,Aceptado por la critica
16,95479,JP,ja,呪術廻戦,"La vida de Itadori cambia para siempre cuando, para salvar a un compañero de clase, se come el dedo de Ryomen Sukuna y absorbe una poderosa maldición.",150.1035,2020-10-03,Jujutsu Kaisen,8.565,4421,Aceptado por la critica
16,61663,JP,ja,四月は君の嘘,"Kōsei Arima, un pianista que perdió la capacidad de oír la música tras la muerte de su madre, lleva una vida aburrida hasta que conoce a Kaori Miyazono, una violinista que lo inspira a regresar a la música.",44.4793,2014-10-10,Your Lie in April,8.564,1138,Aceptado por la critica
35,36189,IT,it,Boris,,6.4467,2007-04-16,Boris,8.564,242,Aceptado por la critica
18,124834,GB,en,Heartstopper,"Dos adolescentes británicos, Nick Nelson y Charlie Spring, estudian en una escuela primaria exclusiva para varones. Charlie, un pensador demasiado nervioso y abiertamente gay, y Nick, un jugador de rugby alegre y de buen corazón, un día se sientan juntos en clase. La amistad florece rápidamente, pero ¿podría haber algo más...? Basada en la novela gráfica de Alice Oseman.",12.9356,2022-04-22,Heartstopper,8.561,1686,Aceptado por la critica
16,85349,US,en,Amphibia,"Anne Boonchuy es una chica de 13 años que es mágicamente transportada al mundo de Anfibilandia, una marisma gigante poblada de ranas parlantes.",18.6186,2019-06-17,Anfibilandia,8.558,338,Aceptado por la critica
16,45790,JP,ja,ジョジョの奇妙な冒険,"La trama se desarrolla en torno a la historia del linaje Joestar, una poderosa familia de origen británico destinada a combatir fuerzas sobrenaturales malvadas usando poderes adquiridos; la obra abarca varias generaciones de dicho linaje, las cuales son adaptadas en cada parte poniendo un descendiente como protagonista, empezando con Jonathan en el año 1880.  El nombre «JoJo», presente en el título de la obra, consiste en un juego de palabras compuesto por el nombre de los protagonistas de cada parte, los cuales pueden abreviarse como «Jojo» y usarse a forma de apodo; sin embargo, en las últimas partes de la obra se hacen juegos de palabras más complejos: por ejemplo, Josuke es un juego de palabras en japonés en que la sílaba «suke» (助) se puede leer también como «jo», y el diminutivo de Giorno Giovana (Gio. Gio.) tiene una pronunciación bastante similar a «Jojo». Todos los Joestar se identifican porque tienen una marca de nacimiento en forma de estrella de cinco puntas.",84.1025,2012-10-06,JoJo's Bizarre Adventure,8.558,1587,Aceptado por la critica
16,240411,JP,ja,ダンダダン,"Cuando Momo, una estudiante de instituto de una familia de médiums espirituales, conoce a su compañero de clase Okarun, un friki del ocultismo, discuten: Momo cree en los fantasmas pero no en los extraterrestres, y Okarun cree en los extraterrestres pero no en los fantasmas. Cuando resulta que ambos fenómenos son reales, en Momo surge un poder oculto y en Okarun el poder de una maldición. Juntos, deberán desafiar a las fuerzas paranormales que amenazan su mundo.",36.9361,2024-10-04,DAN DA DAN,8.544,837,Aceptado por la critica
10759,65844,JP,ja,この素晴らしい世界に祝福を！,"Kazuma, un hikkikomori obsesionado con los videojuegos, muere y es enviado a un mundo alternativo junto a una diosa. En lugar de convertirse en un gran héroe, debe luchar por sobrevivir mientras enfrenta los problemas que ella y el ejército del rey demonio le causan.",25.2184,2016-01-14,KONOSUBA. Un Mundo Maravilloso.,8.6,1425,Aceptado por la critica
16,9302,JP,ja,デジモンテイマーズ,"Digimon Tamers toma lugar en una continuidad diferente a la de su predecesora (Digimon Adventure 02), un mundo parecido al nuestro donde los Digimon son una franquicia de juguetes y una serie de TV. Un grupo de niños de 10 años, Takato, Jenrya y Ruki, se alían con sus propios Digimon, para poder detener a los Digimon Salvajes que intentan invadir el Mundo Real, y detener a una sombría organización del gobierno, que también va contra los Salvajes, aunque con propósitos diferentes. Tercera serie de animación basada en el fenómeno Digimon.",6.3678,2001-04-01,Digimon Tamers,8.553,365,Aceptado por la critica
16,2192,US,en,Robotech,"Serie de TV (1985). 85 episodios. Los avances científicos obtenidos por la humanidad a partir de los restos de una nave alienígena estrellada en el Pacifico Sur, lamentablemente también traerán como consecuencia una serie de guerras contra diferentes razas extraterrestres.",7.4006,1985-03-04,Robotech,8.556,367,Aceptado por la critica
10759,94664,JP,ja,無職転生 ～異世界行ったら本気だす～,"Cuando un autobús atropella a un joven de 34 años que no ha logrado mucho en su vida, su historia no termina ahí. Habiendo reencarnado en un niño, Rudy aprovechará cada oportunidad para vivir la vida que siempre quiso. ¡Con la ayuda de sus amigos, unas habilidades mágicas recién adquiridas, y el coraje para hacer las cosas que siempre ha soñado, se embarca en una aventura épica, con su experiencia pasada intacta!",68.0065,2021-01-11,Mushoku Tensei Jobless Reincarnation,8.6,1459,Aceptado por la critica
18,135157,KR,ko,환혼,"Una poderosa hechicera atrapada en el cuerpo de una mujer ciega se encuentra con un integrante de una prestigiosa familia, que necesita su ayuda para cambiar su destino.",35.8784,2022-06-18,Alquimia de almas,8.551,769,Aceptado por la critica
10765,12313,CA,en,Shadow Hunter,"Clary Fray es una adolescente normal que vive con su madre en Brooklyn. Un día, descubre que es descendiente de una línea de Shadowhunters (Cazadores de Sombras); humanos nacidos con sangre angelical que luchan por proteger nuestro mundo de los demonios. Después de que su madre sea secuestrada, Clary debe unirse a tres Shadowhunters: Jace, Alec e Isabelle y su mejor amigo Simon en una búsqueda para encontrar a su madre y recuperar su pasado.",0.5467,2005-12-08,Cazadores de Sombras,8.5,922,Aceptado por la critica
35,83121,JP,ja,かぐや様は告らせたい～天才たちの恋愛頭脳戦～,"Kaguya es hija de una familia muy importante y millonaria. Shirogane es también hijo de buena familia y presidente del consejo. Ambos son admirados por todos en la Academia Shuchiin, y ambos están enamorados el uno del otro, pero no se rebajarán a admitirlo y ambos intentan que sea el otro el que declare primero su amor.",38.7713,2019-01-12,Kaguya-sama wa Kokurasetai,8.546,832,Aceptado por la critica
16,88040,JP,ja,ギヴン,"Ritsuka Uenoyama es un joven que se aficionó a la guitarra siendo muy joven y tras mucho esfuerzo, consiguió alcanzar el nivel que quería, pero la guitarra que tanto amaba ha perdido su brillo y no le divierte ni le apasiona como antes… hasta que un día conoce a Mafuyu Sato, un joven que se aferra a una guitarra con toda su alma pese a que no sabe tocarla y quien le pedirá que le enseñe a tocar… haciendo que todo en la vida de Uenoyama cambie y la música acelere nuevamente su corazón.",5.5519,2019-07-12,Given,8.545,789,Aceptado por la critica
80,79744,US,en,The Rookie,"Comenzar de nuevo no es fácil, especialmente para el chico de una ciudad pequeña John Nolan que, después de un incidente que cambia su vida, está persiguiendo su sueño de ser un oficial de policía de Los Ángeles. Como el novato más viejo de la fuerza, se ha encontrado con el escepticismo de algunos de los superiores que lo ven como una crisis ambulante.",256.7565,2018-10-16,The Rookie,8.543,3228,Aceptado por la critica
16,61222,US,en,BoJack Horseman,"Conoce al caballo más querido de los 90… veinte años después. Vive en Los Ángeles donde humanos y animales antropomórficos coexisten, BoJack Horseman es la historia de un hombre (bueno, un caballo-hombre) que llegó muy rápido a la cima y ahora tiene que averiguar qué hacer.",41.0032,2014-08-22,BoJack Horseman,8.541,2833,Aceptado por la critica
16,37606,IE,en,The Amazing World of Gumball,"Narra las divertidas aventuras de Gumball y su peculiar familia en el idílico pueblecito de Elmore. Un papá conejo rosa de 1,95 metros, una madre que se gana la vida vendiendo arco iris, un gato azul muy torpe y una conejita con un cerebro superdotado componen la familia protagonista. No hay que olvidar a Darwin, un pez rojo que se convirtió en miembro del clan el día en que le crecieron piernas y pulmones. Así es el asombroso mundo de Gumball.",41.7374,2011-05-03,El asombroso mundo de Gumball,8.54,1722,Aceptado por la critica
16,32118,US,en,Generator Rex,"Serie de TV (2010-2013). Generator Rex (en Latinoamerica Generador Rex) es una serie de animación estadounidense creada por ""Man of Action"" (grupo formado por Duncan Rouleau, Joe Casey, Joe Kelly y Steven T. Seagle), creadores de Ben 10. Fue estrenada en Estados Unidos el 23 de abril de 2010. Se estrenó en Latinoamérica el día 29 de agosto de 2010. En España se estima su estreno en Cartoon Network para el día 15 de Enero de 2011. La serie cuenta las aventuras de un adolescente con superpoderes llamado Rex.",10.0673,2010-04-23,Generator Rex,8.54,410,Aceptado por la critica
16,126506,US,en,Smiling Friends,"Smiling Friends es una pequeña empresa dedicada a repartir felicidad por el mundo, donde sus trabajadores vivirán locas aventuras.",14.0129,2020-04-01,Smiling Friends,8.535,416,Aceptado por la critica
18,94796,KR,ko,사랑의 불시착,"Tras un percance con el parapente, una rica heredera surcoreana aterriza en Corea del Norte y en la vida de un oficial del ejército, que la ayudará a esconderse.",20.3442,2019-12-14,Crash Landing on You,8.536,916,Aceptado por la critica
16,86031,JP,ja,Dr.STONE,"Senku es un joven extremadamente inteligente con un gran don para la ciencia y una ácida personalidad, y su mejor amigo es Taiju, que es muy buena persona pero más apto para usar los músculos que para pensar. Cuando tras cierto incidente toda la humanidad acaba convertida en piedra, ellos logran despertarse en un mundo miles de años después, con la civilización humana completamente desaparecida y con toda la humanidad congelada en piedra como ellos estuvieron. Ahora es su obligación rescatar a la gente y crear un nuevo mundo.",9.9305,2019-07-05,Dr. Stone,8.534,1667,Aceptado por la critica
16,31910,JP,ja,ナルト 疾風伝,"La historia transcurre en un mundo dominado por aldeas ninja. En las cuales el papel del ninja se traduce como el poder de cada país. Cada uno de estos cuenta con su aldea oculta que es donde estudian, entrenan, graduan y forman cada ninja. Los ninjas utilizan todo tipo de artes marciales desde la lucha cuerpo a cuerpo a ilusiones o técnicas secretas como por ejemplo la manipulación de elementos.  El protagonista es un joven aspirante a ninja Uzumaki Naruto, un muchacho que sueña en convertirse algun dia en el líder de su aldea (Hokage). Será para él una tarea difícil ya que cuando era solo un bebé le fué confiado en su interior el poder de un ser malvado, que antaño causo grandes males en su aldea (Konoha) y el cual irá poco a poco descubriendo y dominando. Por culpa de ese poder Naruto pasa una dura infancia con desprecio y negación por parte de los vecinos de su aldea...",56.2909,2007-02-15,Naruto Shippuden,8.534,8631,Aceptado por la critica
16,73488,FR,fr,Les Contes de la rue Broca,Los cuentos de la calle Broca está inspirada la antología de cuentos homónima escrita por Pierre Gripari en 1967.,1.4941,1996-12-23,Los cuentos de la calle broca,8.533,285,Aceptado por la critica
16,83100,JP,ja,どろろ,"Un señor samurai ha regalado los órganos de su hijo recién nacido a cuarenta y ocho demonios a cambio del dominio en el campo de batalla. Sin embargo, el niño abandonado sobrevive gracias a un curandero que lo equipa con prótesis primitivas, letales con las que el hijo maltratado usará para cazar a la multitud de demonios para reclamar su cuerpo pieza por pieza, antes de enfrentarse a su padre. En sus viajes, el joven héroe se encuentra con un huérfano que dice ser el ladrón más grande de Japón.",19.1843,2019-01-07,Dororo,8.532,1307,Aceptado por la critica
