generos_id,ID,Pais_Origen,lenguage_original,Nombre_Original,Resumen,Popularidad,Fecha_primer_estreno,Nombre,Promedio_voto,Conteo_votos,Critica
18,259666,MX,es,Nadie nos va a extrañar,"Son los años 90 y cinco pringados dirigen un negocio ilegal en su instituto: venden trabajos y deberes a sus compañeros. La ventaja es que nadie sospecha nunca de los empollones. El negocio les reporta dinero y popularidad, pero las hormonas y una muerte inesperada amenazan con estropearlo todo. Si el negocio se acaba, su futuro y su amistad corren peligro.",4.2518,2024-08-09,Nadie nos va a extrañar,8.531,290,Aceptado por la critica
80,259909,US,en,Dexter: Resurrection,"Dexter Morgan despierta de un coma de diez semanas y, mientras comienza una dolorosa recuperación, se entera de que su hijo Harrison Morgan ha huido a Nueva York. Tanto el padre como el hijo se sienten más cerca de enfrentarse a la oscuridad de la que han intentado escapar.",11.6997,2025-07-13,Dexter: Resurrección,8.5,512,Aceptado por la critica
18,60574,GB,en,Peaky Blinders,"Una familia de pandilleros asentada en Birmingham, Reino Unido, tras la Primera Guerra Mundial (1914-1918), dirige un local de apuestas hípicas. Las actividades del ambicioso jefe de la banda llaman la atención del Inspector jefe Chester Campbell, un detective de la Real Policía Irlandesa que es enviado desde Belfast para limpiar la ciudad y acabar con la banda.",108.2162,2013-09-12,Peaky Blinders,8.527,11067,Aceptado por la critica
16,256721,JP,ja,ガチアクタ,"En una ciudad flotante donde los ricos se deshacen de su basura y de las personas, a Ludo lo acusan de asesinato y lo arrojan al Abismo, un infierno habitado por las bestias de la basura. Para sobrevivir, deberá hacer uso de un nuevo poder y unirse a los Limpiadores. El objetivo de Ludo no es solo acabar con los monstruos, sino también con aquellos que lo arrojaron al Infierno.",18.3075,2025-07-06,Gachiakuta,8.535,268,Aceptado por la critica
10759,28136,JP,ja,るろうに剣心 明治剣客浪漫譚,"Hace 140 años en el caos del Bakumatsu hubo un imperialista en Kyoto apodado ""Battousai el Destajador"". Asesinó personas en matanzas y abrió el camino a la nueva era Meiji. Era el más fuerte Battousai, sin embargo él desapareció misteriosamente cuando el caos llegó a un final. Aunque se desconoce su paradero. Battousai el Destajador se convirtió en una leyenda.",25.3851,1996-01-10,"Kenshin, el Guerrero Samurái",8.526,805,Aceptado por la critica
16,88803,JP,ja,ヴィンランド・サガ,"Cuando Thors, un gran guerrero viking muere asesinado en batalla a manos de Askeladd, un mercenario, su hijo, Thorfinn, jura vengarse. Para ello tendrá que demostrar su valía antes de ganarse el derecho a retar a un duelo al asesino de su padre.",16.6474,2019-07-08,Vinland Saga,8.5,934,Aceptado por la critica
16,45950,JP,ja,ハイスクールD×D,"La historia esta protagonizada por Issei Hyodou, un estudiante de instituto bastante inútil y pervertido que tiene la mala suerte de ser asesinado por una chica en su primera cita. Issei se reencarna en un demonio y a partir de ese momento tendrá que servir a Rias Gremory, quien es otra demonio de alto rango que casualmente resulta ser la estudiante más guapa de todo su instituto.",40.664,2012-01-06,High School DxD,8.523,2025,Aceptado por la critica
16,77721,JP,ja,３Ｄ彼女　リアルガール,"Tsutsui Hikari es un otaku, y sobre todo evita la vida social. Hikari solo tiene un amigo en la escuela, que también es un inadaptado social, y la mayoría de sus compañeros se burlan brutalmente de él por ser espeluznante y raro. Un día, termina teniendo que limpiar la piscina de la escuela con Igarashi Iroha, que parece ser casi todo lo que odia en las chicas de la vida real. Se saltea la escuela, tiene una manera directa, no tiene amigas, y parece que es promiscua. Sin embargo, ella es amiga de Hikari, e incluso se enfrenta a las personas que se burlan de él. Los problemas de amargura y confianza de Hikari lo llevan a decirle cosas bastante duras a Iroha, pero ella nunca lo descarta como espeluznante. Después de un tiempo, ¡parece que Iroha se convertirá en su primera novia 3D en la vida real! ¿Será capaz de manejarlo?",4.2637,2018-04-04,3D Kanojo: Real Girl,8.521,458,Aceptado por la critica
18,125910,SE,sv,Young Royals,"El príncipe Wilhelm se adapta a la vida en su nuevo y prestigioso internado, Hillerska. Pero seguir lo que le dicta su corazón es más difícil de lo que esperaba.",8.7705,2021-07-01,Jóvenes altezas,8.518,1196,Aceptado por la critica
16,110070,JP,ja,ホリミヤ,"Kyouko es una alumna modélica y popular que al llegar a casa se convierte en una chica hogareña muy discreta. Miyamura, su compañero de clase, es un tipo del montón con cierto aire de friki que en sus ratos libres se transforma en un chico muy atractivo con piercings y mucho estilo. ¿Qué ocurriría si Izumi y Kyouko descubrieran la cara oculta el uno del otro?",23.9666,2021-01-10,Horimiya,8.518,1114,Aceptado por la critica
10765,90447,KR,ko,호텔 델루나,"Jang Man Wol (IU) es la CEO del Hotel del Luna. El hotel está situado en el centro de Seúl y tiene una apariencia muy misteriosa. Ella cometió un gran pecado hace muchos años y, debido a esto, ha estado atrapada en el Hotel del Luna. Aunque hermosa como la luna, tiene mal carácter, es desconfiada y codiciosa.

Goo Chan Sung (Yeo Jin Goo) trabajó como el subdirector más joven en una corporación hotelera multinacional. Es un sincero perfeccionista. Parece sensato, pero en realidad tiene una disposición suave. Debido a un caso inesperado, comienza a trabajar como gerente en el Hotel del Luna.

El hotel del Luna es habitado por clientes fantasmas.",14.1806,2019-07-12,Hotel del Luna,8.517,619,Aceptado por la critica
16,67389,JP,ja,ゴールデンタイム,"Tada Banri, un estudiante nuevo de una escuela privada de abogados en Tokyo, se encontró perdido después de la ceremonia de bienvenida. En ese momento, se encontró con otro estudiante nuevo, Mitsuo Yanagisawa, también perdido. Entonces apareció delante de ellos una chica hermosa con un ramo de rosas, la cual golpea a Mitsuo en la cara con el ramo. La mujer perfecta, bien vestida y elegante que le había pegado a Mitsuo, era su amiga de niñez, Koko Kaga. Como niños se habían prometido casarse algún día. Para escapar de ella, Mitsuo tomó el examen para entrar en esta universidad privada de forma secreta, pero inesperadamente ella apareció allí.",13.9041,2013-10-03,Golden Time,8.512,575,Aceptado por la critica
35,89901,US,en,Dickinson,"La historia se ubica en el siglo XIX donde a través de la mirada y perspectiva de la joven y rebelde poeta Emily Dickinson se explorarán las limitaciones de la sociedad, el género y la familia de su tiempo.",10.6471,2019-11-01,Dickinson,8.517,976,Aceptado por la critica
16,82739,JP,ja,青春ブタ野郎はバニーガール先輩の夢を見ない,"Existe un rumor sobre un fenómeno misterioso llamado ""síndrome de pubertad"". Por ejemplo, Sakuta Azusagawa es una estudiante de secundaria que de repente ve a una conejita aparecer frente a él. La niña es Mai Sakurajima, la chica de clase superior de Sakuta y también una actriz famosa que se ha apartado de la industria del entretenimiento. Por alguna razón, la gente alrededor de Mai no puede ver su figura de conejita. Sakuta se propone resolver este misterio y, a medida que pasa tiempo con Mai, aprende sus sentimientos secretos. Otras heroínas que tienen ""síndrome de pubertad"" comienzan a aparecer frente a Sakuta.",21.4791,2018-10-04,Seishun Buta Yarou wa Bunny Girl Senpai no Yume wo Minai,8.518,1302,Aceptado por la critica
18,108291,KR,ko,설강화,"Im Soo-ho, un estudiante de posgrado de una prestigiosa universidad coreana, aparece en un dormitorio femenino cubierto de sangre. Eun Young-cho, una alegre y adorable estudiante, se ocupa de sus heridas y le ayuda a esconderse.",10.1565,2021-12-18,Snowdrop,8.513,311,Aceptado por la critica
16,76121,JP,ja,ダーリン・イン・ザ・フランキス,"En un futuro distópico, Hiro, un piloto en una ciudad-fortaleza, pierde su habilidad para pilotar un robot Franxx. Su vida cambia al encontrarse con Zero Two, una misteriosa chica con cuernos, y juntos enfrentan amenazas gigantes.",23.8748,2018-01-13,Darling in the FranXX,8.513,1893,Aceptado por la critica
18,66433,KR,ko,달의 연인 - 보보경심 려,"Wang Soo es heredero del Emperador. Él no quiere estar en el centro de atención, pero nace de forma natural en la realeza. Su personalidad es tan fría como el hielo. Hae Soo, quien se encuentra en el tiempo actual, debido a un accidente inesperado termina viajando de regreso a la época histórica. Hae Soo se las arregla para sobrevivir en ese tiempo sin embargo debido a su personalidad y diversas situaciones terminará involucrada con los diferentes príncipes. Tras la muerte del Emperador comienza una guerra por el trono.",13.4179,2016-08-29,Amantes de la Luna Escarlata: Corazón Ryeo,8.511,570,Aceptado por la critica
16,120089,JP,ja,SPY×FAMILY,"El espía ""Twilight"" recibe la misión de infiltrarse en la familia de un líder político. Para ello, crea una falsa familia con una hija que lee mentes y una esposa asesina, mientras ocultan sus secretos y viven juntos en una aventura peligrosa para mantener la paz mundial.",80.892,2022-04-09,SPY x FAMILY,8.5,2250,Aceptado por la critica
16,30981,JP,ja,MONSTER,"El neurocirujano Kenzo Tenma pierde su trabajo y su novia tras salvar a un niño en lugar de al alcalde. Cuando los médicos responsables de su destitución aparecen muertos, Tenma se convierte en sospechoso y comienza a investigar la verdad detrás de las muertes.",57.5043,2004-04-07,Monster,8.514,768,Aceptado por la critica
16,9160,JP,ja,キャンディ・キャンディ,"Candy es una niña huérfana, buena, optimista y con un gran corazón. Cuando era pequeña, vive en un orfanato con su mejor amiga, Annie, también huérfana, y allí ve por primera vez a su 'príncipe de la colina', una persona muy importante en su vida. Candy es adoptada por una familia con dos hermanastros malvados, Eliza y Neal. Un día, en el jardín de rosas, conoce a un chico Idéntico a su príncipe que se llama Antony. Después de esto, empieza una fantástica historia que ella nunca hubiese imaginado.",8.9977,1976-10-01,Candy Candy,8.512,698,Aceptado por la critica
16,138502,US,en,X-Men '97,"X-Men '97 vuelve a la icónica época de los años 90, donde los X-Men, un grupo de mutantes que utilizan sus asombrosos poderes para proteger a un mundo que los odia y los teme, se enfrentarán a su mayor desafío y a un nuevo, insospechado y peligroso futuro.",14.6613,2024-03-20,X-Men '97,8.509,665,Aceptado por la critica
10759,117376,KR,ko,빈센조,"[Vincenzo] A la edad de 8 años, Park Joo Hyung fue a Italia después de ser adoptado. Ahora es adulto y se llama Vincenzo Cassano, es abogado y trabaja para la mafia como consejero. Decide regresar a Corea del Sur porque encontró algo valioso y lo va a obtener ahora que se retiró de la mafia. Cuando llega a Corea del Sur, se involucra con la abogada Hong Cha Young y los habitantes de Geumga Plaza y la vida de Vincenzo cambia.",23.3178,2021-02-20,Vincenzo,8.509,1065,Aceptado por la critica
16,68129,JP,ja,ユーリ!!! on ICE,"Tras una dura derrota en la Gran Prix Final, Yuuri Katsuki regresa a casa indeciso sobre su futuro en el patinaje. Todo cambia cuando el campeón mundial Victor Nikiforov aparece para entrenarlo, junto a Yuri Plisetsky, un prometedor patinador ruso. Juntos, afrontarán un desafío sin precedentes.",17.7236,2016-10-06,Yuri!!! on Ice,8.508,657,Aceptado por la critica
80,19885,GB,en,Sherlock,"En esta renovada versión de las historias de misterio de Arthur Conan Doyle, el excéntrico detective merodea por las calles del Londres de hoy en día en busca de pistas.",33.0779,2010-07-25,Sherlock,8.508,6389,Aceptado por la critica
18,96462,KR,ko,사이코지만 괜찮아,"Una historia sobre un empleado de una sala psiquiátrica y una mujer, con un trastorno de personalidad antisocial, que es una escritora popular de libros infantiles. Un hombre que niega el amor y una mujer que no conoce el amor desafían el destino y se enamoran, encontrando sus almas e identidades en el proceso.",12.3835,2020-06-20,Está bien no estar bien,8.507,1472,Aceptado por la critica
16,40143,JP,ja,シャーマンキング,"La historia comienza cuando Manta Oyamada, un estudiante de secundaria, toma un atajo por el cementerio local y divisa a un joven misterioso que simplemente observa las estrellas llamado Yoh Asakura, el cual le invita a quedarse con él y sus ""amigos"", pero Manta huye asustado al ver que estos eran fantasmas. Tiempo después Yoh se revela así mismo como un ""chamán"" (el vínculo entre este mundo y el de los espíritus) para demostrarle a Manta que entre ellos ha nacido una amistad.",10.6454,2001-07-04,Shaman King,8.507,442,Aceptado por la critica
16,83095,JP,ja,盾の勇者の成り上がり,Un joven otaku es convocado por arte de magia a un universo paralelo como uno de los cuatro héroes elegidos para salvar el mundo de su vaticinada destrucción.,18.2669,2019-01-09,The Rising of the Shield Hero,8.506,1546,Aceptado por la critica
16,114410,JP,ja,チェンソーマン,"Denji es un adolescente que vive con un demonio motosierra llamado Pochita. Para pagar la deuda que le dejó su padre tras su muerte, ha tenido que ganarse el pan como puede matando demonios y vendiendo sus cadáverse a la mafia, aunque su vida siempre ha sido miserable.

Cuando una traición provoca la muerte de Denji, Pochita hace un contrato con él y Denji revive como ""Chainsaw Man"", un ser humano con el corazón de un demonio.",50.9107,2022-10-12,Chainsaw Man,8.505,2125,Aceptado por la critica
10764,106600,KR,ko,In the SOOP BTS편,,2.2529,2020-08-19,BTS In the SOOP,8.5,405,Aceptado por la critica
18,83639,TH,th,เด็กใหม่,Nanno es una chica inteligente y misteriosa que va de un instituto a otro sacando a la luz los secretos más oscuros tanto de alumnos como de profesores.,13.2813,2018-10-27,Girl from Nowhere,8.5,941,Aceptado por la critica
16,30991,JP,ja,カウボーイビバップ,"La tripulación de la nave Bebop solo intenta ganar dinero, y son la pandilla de caza-recompensas más divertida del año 2071.",38.7003,1998-04-03,Cowboy Bebop,8.5,1926,Aceptado por la critica
16,67075,JP,ja,モブサイコ100,"Kageyama Shigeo, más conocido por el apodo ""Mob"", parece un chico tímido con problemas para relacionarse con los demás, pero en realidad. es un poderoso Esper. Mob quiere ser un niño normal y corriente pero, para mantener su poder psíquico bajo control, tiene que reprimir constantemente sus emociones. Sin embargo, los problemas le persiguen, y vive rodeado por falsos Espers, espíritus malignos y misteriosas organizaciones.",61.7998,2016-07-12,Mob Psycho 100,8.504,1297,Aceptado por la critica
16,3793,US,en,Invader ZIM,"Serie de culto que fue cancelada dada su extentricidad para los más jóvenes. La trama gira alrededor de un extraterreste llamado Zim, originario del Imperio Irken, cuyo deseo es controlar todo el universo. Los Más Altos lo envían, junto al robot G.I.R., a colonizar un planeta desconocido y lejano para deshacerse de su inutilidad y los destrozos que deja a su paso. Ese planeta es la Tierra y allí Zim encuentra a su némesis, Dib.",8.2119,2001-03-30,Invasor Zim,8.5,455,Aceptado por la critica
99,83880,GB,en,Our Planet,Un documental excepcional que invita a sumergirse en la belleza natural del planeta Tierra y a reflexionar sobre el impacto del calentamiento global en sus moradores.,6.2761,2019-04-05,Nuestro planeta,8.502,448,Aceptado por la critica
16,15260,US,en,Adventure Time,"Un niño de 12 años y su mejor amigo, un sabio perro de 28 años con poderes mágicos, se embarcan en una serie de aventuras surrealistas.",47.0437,2010-04-05,Hora de aventuras,8.502,3096,Aceptado por la critica
18,108261,KR,ko,철인왕후,"En la actualidad, Jang Bong Hwan trabaja como chef en la Casa Azul del Presidente. Tiene un espíritu libre, pero su espíritu de alguna manera encuentra su camino hacia el cuerpo de la reina Kim So Yong en el período Joseon.

El rey Cheol Jong tiene secretos. Parece una figura decorativa, amable y tolerante. De hecho, esconde sus aspectos fuertes. La reina Sunwon es la esposa del difunto rey Sunjo. Ella ejerce el verdadero poder en el país y, por lo tanto, relega al Rey Cheol Jong como solo una figura decorativa. Kim Jwa Geun es el hermano menor de la reina Sunwon. Es extremadamente ambicioso.",12.5724,2020-12-12,Señor Reina,8.5,482,Aceptado por la critica
35,68349,KR,ko,역도요정 김복주,"[Weightlifting Fairy Kim Bok Joo] Cuenta la historia de Kim Bok Joo, una joven de 22 años de edad. Huérfana de madre, quien se quedó al cuidado de su padre, un ex levantador de pesas. Asiste a la universidad Hanwool, en la especialidad de Educación física, en la cual muchos atletas entrenan para competencias y así poder representar a su país; ella al igual que su padre se dedica al levantamiento de pesas. Bok Joo conocerá a su primer amor, un médico de una clínica de obesidad. Sin embargo, ella no contaba con que el hermano de este médico fuera Jung Joon Hyung, un viejo compañero de la escuela primaria, con quien además tendrá una colorida amistad. ¿Solo tendrán una bella amistad o nacerán sentimientos románticos?",9.0804,2016-11-16,El Hada De Las Pesas Kim Bok Joo,8.498,948,Aceptado por la critica
16,73223,JP,ja,ブラッククローバー,"La historia de Black Clover nos pone en la piel de un joven llamado Asta, el cual quiere convertirse en el mago más grande del reino. Sin embargo, hay un inconveniente: ¡no puede usar magia! Por suerte, Asta recibe el grimorio trébol de cinco hojas, que le otorga el poder de la anti-magia. ¿Puede alguien carente de magia convertirse en el Rey Hechicero? Una cosa está clara, Asta nunca se rendirá.",20.647,2017-10-03,Black Clover,8.497,2088,Aceptado por la critica
18,230923,KR,ko,선재 업고 튀어,"Ryu Sun-jae, un idol coreano agotado por la fama, pone fin a su propia vida. Im Sol, que en su adolescencia quedó paralítica tras un accidente y perdió por completo las ganas de vivir, encontró consuelo en las palabras de ánimo de Sun-jae y se convirtió en su mayor admiradora. Al conocer su muerte, queda devastada; entonces, de forma inexplicable, viaja quince años al pasado y se encuentra con un Sun-jae de 19 años. Decidida a cambiar el futuro, hará todo lo posible por salvarlo del destino que le espera.",14.3774,2024-04-08,Lovely Runner,8.502,263,Aceptado por la critica
10765,204154,US,en,Scavengers Reign,"Cuando un carguero del espacio profundo es dañado por una llamarada solar, su tripulación sobreviviente queda varada en un planeta hermoso e implacable. Comienzan a entender la verdadera naturaleza de este planeta mientras intentan sobrevivir el tiempo suficiente para escapar o ser rescatados.",6.3039,2023-10-19,Planeta de recolectores,8.496,395,Aceptado por la critica
10759,35935,JP,ja,剣風伝奇ベルセルク,"Durante más de 100 años, los magníficos ejércitos de Chuder y los de la región central han luchado en sangrientas batallas. Tan sólo la impenetrable fortaleza Doldery mantiene al Imperio de Chuder a salvo de todas las guerras que les rodean. La banda de los Halcones han tomado posiciones en la gran ofensiva. En esta batalla, las tropas de la región central podrán llegar hasta las puertas de la legendaria fortaleza de Chuder y desafiar al ejército invencible del General Boscongn.",34.0811,1997-10-08,Berserk: La Historia de la Espada Feroz,8.5,779,Aceptado por la critica
9648,126485,KR,ko,무빙,"Kim Bong-Seok, Jang Hee-soo y Lee Gang-hoon van al mismo instituto. Parecen estudiantes normales, pero tienen habilidades especiales heredadas de sus padres.

Kim Bong-seok tiene la capacidad de volar, mientras que Jang Hee-soo posee excelentes habilidades atléticas y es capaz de recuperarse rápidamente de heridas, como disparos o puñaladas. Lee Gang-hoon tiene un poder y una velocidad asombrosos.

Estos tres estudiantes intentan ocultar sus habilidades especiales a los demás, a la vez que sus padres luchan por evitar que sean utilizados por otras personas.",24.8811,2023-08-09,Moving,8.495,282,Aceptado por la critica
16,75214,JP,ja,ヴァイオレット・エヴァーガーデン,"La guerra ha terminado y Violet Evergarden necesita trabajo. Incapaz de sentir emociones, acepta un empleo como escritora de cartas para entender el pasado.",15.1593,2018-01-11,Violet Evergarden,8.494,947,Aceptado por la critica
99,58474,US,en,Cosmos,"Más de 30 años después de que Carl Sagan buscase los límites del universo y del hombre a través de la ciencia, Cosmos: Una odisea en el espacio-tiempo propone un nuevo viaje hacia las estrellas. Presentado por el prestigioso astrofísico Neil deGrasse Tyson, esta continuación explora cómo descubrimos las leyes de la naturaleza y encontramos nuestro lugar en el tiempo y el espacio.",16.4647,2014-03-09,Cosmos: Una odisea en el espacio-tiempo,8.492,1671,Aceptado por la critica
10765,6357,US,en,The Twilight Zone,"Serie de televisión especializada en el género de la ciencia-ficción. Fue creada por su narrador y anfitrión, Rod Serling, y cada episodio recrea un relato de fantasía, terror, suspense o ciencia ficción, a menudo rematado por un final sorprendente.",30.6307,1959-10-02,La dimensión desconocida,8.491,1023,Aceptado por la critica
10764,154521,US,en,The Kardashians,"La familia a la que tanto conoces y adoras vuelve con una nueva serie dando acceso pleno a toda su vida. Kris, Kourtney, Kim, Khloé, Kendall y Kylie se exponen ante las cámaras para revelar los secretos que hay tras los titulares. Desde la enorme presión de dirigir negocios multimillonarios hasta los divertidos momentos llenos de juegos y abandono escolar. Esta serie no dejará a ningún espectador indiferente con esta fascinante y honesta historia de amor y vida ante los focos.",13.7482,2022-04-14,Las Kardashian,8.487,2125,Aceptado por la critica
10764,117648,GB,en,Clarkson's Farm,"Un año intenso, arduo y muy divertido en la vida del agricultor más insólito de Gran Bretaña, Jeremy Clarkson. Únete a Jeremy y a su grupo de socios agrícolas mientras se enfrentan a un tiempo de locos, animales desobedientes, cultivos que no crecen y una pandemia inesperada. Verás a Jeremy Clarkson como nunca antes lo habías visto.",11.3467,2021-06-11,La granja de Clarkson,8.487,399,Aceptado por la critica
35,1600,US,en,Ned's Declassified School Survival Guide,"El Manual de Supervivencia Escolar de Ned ocurre en California, en la Secundaria James K. Polk. El protagonista es Ned Bigby, un joven que cursa el séptimo curso, que enfrenta muchas pruebas y tribulaciones en la secundaria. Ned es conocido en el instituto entero por ir dando consejos a sus compañeros, y también a la audiencia sobre diferentes temas y situaciones que se producen día a día en su secundaria: el primer día, clubes, profesores, matones, novias, amistades, problemas, etc.",13.3898,2004-09-12,Manual de supervivencia escolar de Ned,8.485,999,Aceptado por la critica
18,333,KR,ko,대장금,"Hace 500 años, durante los tiempos de la Dinastía Joseon, Corea tenía  una rígida jerarquía y una estructura social dominada por hombres.  Ambientado en este período, Dae Jang Geum está basada en una historia  verdadera acerca de una mujer legendaria (Jang Geum) quien se convirtió  en la primera mujer en ser el Médico Personal del Rey de sus tiempos. A  pesar de vivir en condiciones pobres como una chica de clase baja en una  sociedad dominada por hombres, Jang Geum supera una serie de  discriminaciones sociales y consigue llegar a ser la Cocinera Real, para  luego convertirse en Médico Real y por último convertirse en el Médico  Personal del Rey. Incluso a ella se le otorgó el título, por parte del  Rey, de “La gran Jang Geum”.",13.1634,2003-09-15,Una Joya en el Palacio,8.485,274,Aceptado por la critica
18,229480,KR,ko,손해 보기 싫어서,"Son Hae Yeong es una mujer soltera que odia fracasar y no quiere perder dinero bajo ninguna circunstancia. Tiene una mala relación con el chico de la tienda de conveniencia, Kim Ji Uk, el cual es el tipo de persona que no puede ignorar a la gente necesitada y trata de hacer lo correcto. Un día, Hae Yeong descubre que en su empresa solamente dan beneficios y cargos importantes a aquellos que están casados, dejándola fuera de juego en un concurso para un proyecto importante. Es entonces cuando decide hacer una boda falsa y escoge como prometido a Ji Uk, dando lugar a un mar de líos.",10.9353,2024-08-26,El que no ama no gana,8.484,274,Aceptado por la critica
16,93019,JP,ja,俺を好きなのはお前だけかよ,"En la serie de comedia romántica, a Amatsuyu Kirasagi le piden encontrarse la genio de último año Cosmos y su amiga de la infancia Himawari. Esperando escuchar sus confesiones, triunfalmente va a encontrarse con cada una de ellas. Pero Cosmos y Himawari, en cambio, le confiesan a Amatsuyu que les gusta su amigo Sun. Amatsuyu lucha en esta batalla solitaria, pero hay otra chica que lo está mirando. Ella es una niña sombría con gafas y trenzas. Amatsuyu la odia, porque ella siempre está utilizando su lengua afilada alrededor de él y encuentra placer en sus problemas. Pero resulta que ella es la única a quien realmente le gusta.",6.056,2019-10-03,Ore wo Suki nano wa Omae dake ka yo,8.484,281,Aceptado por la critica
