generos_id,ID,Pais_Origen,lenguage_original,Nombre_Original,Resumen,Popularidad,Fecha_primer_estreno,Nombre,Promedio_voto,Conteo_votos,Critica
18,79818,CN,zh,流星花园,"Popular serie taiwanesa basada en el manga japonés ""Hana Yori Dango"" de Yoko Kamio. Shan Cai, una chica de clase media baja, va a la escuela privada Ying De, exclusiva para gente rica. Además de ser mirada con desprecio por sus compañeros millonarios, ella ha hecho enfurecer al líder de un grupo conocido como los F4, que son los herederos de las cuatro familias más ricas. Sus familias donan mucho dinero a la escuela, así que nadie se atreve a desafiarlos. Shan Cai ha sido la única que se ha atrevido a enfrentarse a Dao Ming Tse y eso hizo que despertara en él un interés hacia ella. No obstante, su continuo hostigamiento ha hecho que Shan Cai lo odie y también que se haya enamorado de Hua Ze Lei, quien siempre la ayudado en sus problemas.",10.2397,2018-07-09,Jardín de meteoros (Meteor Garden),8.483,608,Aceptado por la critica
10759,225180,US,en,BLUE EYE SAMURAI,"La convirtieron en una paria en el Japón del periodo Edo. Ahora, una joven espadachina sedienta de venganza recorre un camino sangriento hacia su destino.",10.03,2023-11-03,Samurái de ojos azules,8.5,754,Aceptado por la critica
16,100049,JP,ja,トニカクカワイイ,"Nasa Yuzaki se enamora a primera vista de la misteriosa Tsukasa, pero ella acepta salir con él solo si se casan. Así comienza su inesperada y encantadora vida matrimonial.",19.3802,2020-10-03,TONIKAWA: Over the Moon for You,8.482,1552,Aceptado por la critica
18,197067,KR,ko,이상한 변호사 우영우,"Woo Young-woo, una brillante abogada con autismo, lidia con los retos que le plantean la vida cotidiana y los tribunales cuando se incorpora a un importante bufete.",19.8245,2022-06-29,"Woo, abogada extraordinaria",8.479,928,Aceptado por la critica
16,42444,JP,ja,聖闘士星矢,"Según la leyenda, hace siglos, jóvenes guerreros investidos de grandes poderes al canalizar el cosmos dentro de ellos eran los encargados de proteger a Atenea, la Diosa de la Guerra. Años después, ahora es la princesa Saori Kido, reencarnación de la Diosa, quien debe recibir protección. Un jovén llamado Seiya se ha entrenado con el fin de convertirse en caballero y conseguir la armadura de Pegaso. A él se unen otros caballeros con sus armaduras para luchar por la diosa Atenea.",24.301,1986-10-11,Los Caballeros del Zodiaco,8.5,1410,Aceptado por la critica
10759,75006,US,en,The Umbrella Academy,"Un grupo disuelto de superhéroes se reúne después de que su padre adoptivo, quien los entrenó para salvar el mundo, muere.",19.8671,2019-02-15,The Umbrella Academy,8.478,9958,Aceptado por la critica
16,65648,JP,ja,会長はメイド様！,"Ayuzawa Misaki, presidenta del consejo estudiantil, es la protagonista de esta comedia romántica con su enorme aversión hacia los hombres, lo cual resulta ser un gran problema ya que su escuela solía ser solo de hombres y la población femenina es bastante reducida. Misaki tiene un ?enorme secreto? ya que trabaja en un maid cafe y es descubierta por Usui Takumi, el chico mas guapo y popular de la escuela.",8.7688,2010-04-02,Kaichou wa Maid-sama!,8.5,616,Aceptado por la critica
16,30669,JP,ja,幽☆遊☆白書,"Yusuke Urameshi, un chico de catorce años un poco gamberro es atropellado por un coche cuando intentaba salvar la vida de un niño pequeño. Al ser atropellado, no sobrevive y muere. Entonces es cuando Botan le dice que su muerte no estaba prevista asi que no va ni al cielo ni al infierno, por lo cual se queda en la tierra como fantasma. Botan le dice de hacer una prueba para volver a la vida, la consigue superar y entonces es cuando le encomiendan la tarea de ser detective espiritual, con lo cual tendrá que resolver varios casos utilizando poderes espirituales que le dan.",19.8729,1992-10-10,Yu Yu Hakusho,8.475,484,Aceptado por la critica
16,79732,US,en,She-Ra and the Princesses of Power,"Adora encuentra una espada mágica y descubre así su identidad de She-Ra, la legendaria heroína. Al unirse a la Rebelión, su mejor amiga se queda con la Horda del terror.",15.5733,2018-11-13,She-Ra y las princesas del poder,8.472,813,Aceptado por la critica
16,65249,JP,ja,僕だけがいない街,Satory Fujinuma es un autor de manga sin mucho éxito que sufre de un peculiar fenómeno conocido como Resucitación en el cual se transporta a la fuerza atrás en el tiempo hasta el momento anterior de que ocurra algo que supone un peligro para una vida. Satoru no tarda en descubrir que el fenómeno persiste hasta que la causa de la amenaza desaparece.,8.8602,2016-01-08,Desaparecido,8.468,1241,Aceptado por la critica
16,207250,JP,ja,僕の心のヤバイやつ,"Kyotaro Ichikawa es un estudiante de secundaria que pasa todo su tiempo observando a su compañera de clase, Anna Yamada, y especialmente imaginando cómo podría asesinarla. Pero cuando la mira, se da cuenta de que Yamada puede ser diferente de la imagen que tenía de ella.",30.7693,2023-04-02,Peligros en mi corazón,8.5,230,Aceptado por la critica
35,92468,MX,es,La Familia del Barrio,"Es una serie de televisión mexicana de animación, creada por Teco Lebrija y Arturo Navarro para la televisora MTV. Está dirigida al público adulto y se caracteriza por satirizar con humor negro la sociedad, actualidad y cultura mexicana a través de las historias y situaciones surrealistas que les suceden a sus protagonistas. Primero era trasmitida por la plataforma de YouTube hasta que en mayo de 2013 llegó a la televisión por MTV.1",1.8049,2013-05-05,La Familia del Barrio,8.467,503,Aceptado por la critica
35,2004,US,en,Malcolm in the Middle,"Sitcom familiar que aborda los divertidos problemas y situaciones de una familia americana de clase media en la que el hijo Malcolm parece ser el único sensato... o al menos el único que da señales de cordura. La familia está compuesta por sus neuróticos padres Hal y Lois, el hermano mayor Francis y sus otros dos hermanos, Reese y Dewey.",60.3426,2000-01-09,Malcolm,8.467,4823,Aceptado por la critica
10759,4194,US,en,Star Wars: The Clone Wars,"La escasa tropa Jedi lucha por mantener la libertad y devolver la paz a la Galaxia frente al aparentemente interminable ejército droide, clones diseñados genéticamente. A través de cientos de planetas, los Caballeros Jedi y los Separatistas combaten por el futuro de la Galaxia, pero el número de planetas que van cayendo en manos del Lado Oscuro cada vez es mayor a causa de los movimientos de los Separatistas. El terrible conflicto se agrava porque nuestros héroes se ven absorbidos por la confusión de guerra, mientras el Conde Dooku, el asesino Asajj Ventress, su maestro Darth Sidious, el General Grievous y una amplia galería de enemigos nunca antes visto también conspiran y se unen para derrotarlos.

La historias de la serie 'Star Wars: The clone wars' transcurre entre el ""Episodio II: El ataque de los clones' y el ""Episodio III: La venganza de los Sith"" de la saga Star Wars.",46.8431,2008-10-03,Star Wars: The Clone Wars,8.5,2337,Aceptado por la critica
18,136283,KR,ko,더 글로리,"Muchos años después de ser brutalmente agredida en el instituto, una mujer pone en marcha un elaborado plan de venganza para que los responsables paguen por sus crímenes.",22.451,2022-12-30,La gloria,8.464,894,Aceptado por la critica
10765,45952,JP,ja,HUNTER×HUNTER,"La historia tiene como protagonista a Gon Freecss, un niño de doce años que desea encontrar a su padre a toda costa, por lo que decide convertirse en «cazador», justo como él, y de alguna forma hallar su paradero. A medida que avanza la historia, Gon se hace amigo de otros tres aspirantes a cazador: Leorio, Kurapika y Killua, quienes lo acompañarán en sus aventuras.",24.2693,1999-10-16,HunterxHunter,8.5,209,Aceptado por la critica
18,96160,KR,ko,나 홀로 그대,Una mujer de éxito que padece de afasia tiene problemas sociales debido a su incapacidad para reconocer los rostros de quienes la rodean,4.2311,2020-02-07,"Holo, Mi Amor",8.463,880,Aceptado por la critica
10765,1399,US,en,Game of Thrones,"En una tierra donde los veranos duran décadas y los inviernos pueden durar toda una vida, los problemas acechan. Desde las maquinaciones del sur a las salvajes tierras del este, pasando por el helado norte y el milenario muro que protege el reino de las fuerzas tenebrosas, dos poderosas familias mantienen un enfrentamiento letal por gobernar los Siete Reinos de Poniente. Mientras la traición, la lujuria y las fuerzas sobrenaturales sacuden los pilares de los reinos, la sangrienta batalla por el trono de Hierro tendrá consecuencias imprevistas y trascendentales. El invierno se acerca. Que empiece 'Juego de tronos'.",166.4123,2011-04-17,Juego de tronos,8.461,26825,Aceptado por la critica
16,64196,JP,ja,オーバーロード,"La historia da comienzo cuando Yggdrasil, un popular juego online, es cerrado un día sin previo aviso. Sin embargo, el protagonista, Momonga, decide no salir del juego. Momonga así se transforma y se convierte en “el mago más poderoso”. El mundo sigue cambiando con él dentro y los NPCs comienzan a sentir emociones. Sin familia, amigos ni lugar en la sociedad, Momonga tendrá que luchar por adaptarse al nuevo mundo en el que se ha convertido el juego.",20.2775,2015-07-07,Overlord,8.46,1087,Aceptado por la critica
16,105248,JP,ja,サイバーパンク: エッジランナーズ,"En una distopía plagada de corrupción e implantes cibernéticos, un chico prodigioso pero temerario trata de convertirse en un mercenario proscrito: un ‘edgerunner’.",21.1576,2022-09-13,Cyberpunk: Edgerunners,8.459,1782,Aceptado por la critica
10765,76479,US,en,The Boys,"La serie tiene lugar en un mundo en el que los superhéroes representan el lado oscuro de la celebridad y la fama. Un grupo de vigilantes que se hacen llamar ""The Boys"" decide hacer todo lo posible por frenar a los superhéroes que están perjudicando a la sociedad, independientemente de los riesgos que ello conlleva.",861.396,2019-07-25,The Boys,8.46,12483,Aceptado por la critica
18,71712,US,en,The Good Doctor,Un cirujano joven y autista que padece el síndrome del sabio empieza a trabajar en un hospital prestigioso. Allá tendrá que vencer el escepticismo con el que sus colegas lo reciben.,93.1344,2017-09-25,The Good Doctor,8.459,12822,Aceptado por la critica
16,42509,JP,ja,Steins;Gate,"Okabe Rintarou, autoproclamado científico loco, descubre accidentalmente cómo viajar en el tiempo. Tras evitar un asesinato, se enfrenta a las consecuencias de cambiar el pasado junto a sus amigos en su laboratorio secreto.",19.446,2011-04-06,Steins;Gate,8.455,939,Aceptado por la critica
10751,68267,US,en,Trollhunters: Tales of Arcadia,"Trollhunters narra las aventuras del grupo de residentes del vecindario ficticio conocido como Arcadia, donde descubrirán que existe un mundo debajo de su querida ciudad que es tan amplio y asombroso como ningún otro que conozcan en la superficie.  Nadie en el pueblo cree en los rumores que indican que los trolls existen, pero el joven de 15 años Jim Jr. está por descubrir que son una amenaza bastante real y que durante la noche casi nadie está seguro.",10.3082,2016-12-23,Trollhunters: Cuentos de Arcadia,8.454,1140,Aceptado por la critica
18,66330,KR,ko,W(더블유),"Oh Yeon Joo es una cirujana cardiotorácica en sus 30 cuyo padre se dedica a escribir el webtoon más famoso de Corea, ""W"". El autor, harto ya del personaje de Kang Chul, decide que es hora de matarlo. Sin embargo, por sucesos inesperados, ella se traslada al mundo ficticio donde vive Kang Chul y lo salva. De ahí en adelante Oh Yeon Joo intentará averiguar que sucede realmente para que ambos mundos se unan y por qué su padre está empecinado en matar al personaje principal de su obra.",9.3329,2016-07-20,W: Entre Dos Mundos,8.5,964,Aceptado por la critica
18,210733,CN,zh,偷偷藏不住,,18.6943,2023-06-20,Amor Oculto,8.451,235,Aceptado por la critica
16,207468,JP,ja,怪獣８号,"Japón sufre constantes ataques de Kaijus, y Kafka Hibino, un limpiador de sus restos, sueña con unirse a las Fuerzas de Defensa. Todo cambia cuando una criatura lo transforma en un Kaiju, ganándose el nombre de ""Kaiju N.8"".",25.943,2024-04-13,Kaiju No. 8,8.451,747,Aceptado por la critica
10765,34524,US,en,Teen Wolf,"Un animal muerde a un chico y lo convierte en hombre lobo. De repente, es el rey del deporte y de las chicas del instituto. Pero también afronta nuevos problemas.",70.8653,2011-06-05,Teen Wolf,8.45,4699,Aceptado por la critica
16,123249,JP,ja,その着せ替え人形は恋をする,"Gojo Wakana, un estudiante que sueña con hacer muñecas Hina, se une a Marin Kitagawa, la chica popular de su clase, cuando ella comparte un secreto que los acerca.",44.0695,2022-01-09,My Dress-Up Darling,8.448,892,Aceptado por la critica
35,107113,US,en,Only Murders in the Building,Tres extraños que comparten la obsesión por los crímenes reales y de repente se ven envueltos en uno al investigar la misteriosa muerte de un vecino en su edificio de Nueva York.,24.9813,2021-08-31,Solo asesinatos en el edificio,8.448,2164,Aceptado por la critica
16,99779,JP,ja,NOBLESSE -ノブレス-,"Historia de fantasía donde conoceremos a un poderoso vampiro de la nobleza que acaba en la civilización moderna tras un sueño de 820 años. Junto a nuevos amigos vivirá peligrosas aventuras y combatirá a una organización secreta, además de descubrir su pasado.",6.6453,2020-10-08,Noblesse,8.446,420,Aceptado por la critica
18,221851,KR,ko,내 남편과 결혼해줘,"Kang Ji-won, una enferma terminal de cáncer, es asesinada por su marido y su mejor amiga tras descubrir que tienen una aventura. Se despierta diez años antes del incidente y decide vengarse con la ayuda de Yu Ji-hyuk, el director de la empresa donde trabaja. Ahora debe recuperar su destino y sacar la basura de su vida.",13.7037,2024-01-01,Cásate con mi esposo,8.443,663,Aceptado por la critica
18,218539,KR,ko,마이데몬,"Un demonio pierde sus poderes cuando su camino se cruza con el de una gélida heredera, que podría tener la clave para recuperar sus habilidades... y conquistar su corazón.",16.2418,2023-11-24,Mi adorable demonio,8.443,645,Aceptado por la critica
16,72517,JP,ja,ようこそ実力至上主義の教室へ,"Kiyotaka Ayanokouji ingresa a la prestigiosa Academia Tokyo Koudo Ikusei, pero es asignado a la Clase 1-D, donde están los estudiantes con problemas. La escuela otorga puntos mensuales equivalentes a 100,000 yenes y permite una libertad inusual en las clases, ocultando un sistema más complejo.",50.4633,2017-07-12,Classroom of the Elite,8.4,802,Aceptado por la critica
18,129888,KR,ko,스물다섯 스물하나,"Los sueños de dos jóvenes se ven aplastados por una abrumadora crisis financiera en la década de 1990. Pero cuando se reencuentran a la edad de 25 y 21 años, la enérgica pareja encuentra amistad y afecto en tiempos de adversidad mientras se aventuran juntos en la edad adulta.",10.842,2022-02-12,"Veinticinco, veintiuno",8.441,328,Aceptado por la critica
16,107124,US,en,Animaniacs,"Los hermanos Warner, Yakko y Wakko, y Dot, se lo pasan genial causando estragos y caos en las vidas de todos los que conocen. Después de regresar a su amada casa, Warner Bros. Water Tower, los Animaniacs no pierden tiempo en causar caos y confusión cómica mientras corren sueltos por el estudio y más allá, convirtiendo el mundo en su patio de recreo personal. Junto a Yakko, Wakko y Dot, los personajes favoritos de los fans, Pinky and the Brain, también regresarán para continuar su búsqueda de la dominación mundial.",14.7775,2020-11-20,Animaniacs,8.441,589,Aceptado por la critica
80,117378,KR,ko,마우스,"""Mouse"" es un drama sobre psicópatas, una historia de suspenso que se centrará en la pregunta clave: ¿Qué pasaría si pudiéramos resolver los problemas pensando como psicópatas?",17.206,2021-03-03,Mouse,8.4,316,Aceptado por la critica
18,224372,US,en,A Knight of the Seven Kingdoms,"Un siglo antes de los acontecimientos de ""Juego de Tronos"", dos héroes improbables vagaban por Poniente: un joven e ingenuo, pero valiente caballero, Ser Duncan el Alto, y su pequeño escudero, Egg. Ambientada en una época en la que el linaje Targaryen aún ostenta el Trono de Hierro y el recuerdo del último dragón aún no ha desaparecido de la memoria viva, grandes destinos, poderosos enemigos y peligrosas hazañas aguardan a estos improbables e incomparables amigos.",28.0496,2026-01-18,El caballero de los Siete Reinos,8.439,867,Aceptado por la critica
16,62565,JP,ja,俺物語!!,"Takeo Gouda, un chico gigante de gran corazón, siempre ve cómo las chicas que le gustan se enamoran de su mejor amigo. Resignado, su vida cambia cuando salva a Yamato de un acosador en el tren, iniciando una historia inesperada.",16.8327,2015-04-09,Ore Monogatari!!,8.437,375,Aceptado por la critica
16,35753,JP,ja,ゼロの使い魔,"Louise Françoise Le Blanc de La Vallière es una miembro de la nobleza que es terrible en la magia, ya que sus intentos suelen resultar en una explosión. Sus compañeros la apodan «Louise the Zero», debido a su incapacidad para usar cualquiera de los cuatro elementos mágicos. En la Academia de Magia de Tristain, los estudiantes de segundo año realizan un ritual especial en el que convocan a su familiar , que sirve como su compañero, protector y socio eterno, y generalmente es algún tipo de criatura mágica. Pero Louise convoca a Saito Hiraga, un adolescente normal de Japón, dejándola totalmente humillada.",13.2803,2006-07-03,Zero no Tsukaima,8.439,601,Aceptado por la critica
16,56568,JP,ja,NANA,"Dos chicas llamadas Nana se conocen en un tren rumbo a Tokio. Una busca éxito con su banda de punk rock, mientras la otra sigue a su novio. Al decidir vivir juntas, sus vidas se entrelazan en una historia de amistad, amor y sueños en la gran ciudad.",21.6033,2006-04-05,Nana,8.436,249,Aceptado por la critica
18,87739,US,en,The Queen's Gambit,"Kentucky, años 50. En el orfanato, una chica descubre que posee un talento extraordinario para el ajedrez mientras intenta superar una adicción.",16.621,2020-10-23,Gambito de dama,8.435,5476,Aceptado por la critica
16,87461,JP,ja,世話やきキツネの仙狐さん,"La estrensante vida del oficinista Nakano cambia por completo el día que conoce a Senko, una pequeña chica zorra que está dispuesta a cuidar de él hasta que pueda deshacerse del cansancio, ¡cueste lo que cueste!",6.3047,2019-04-10,"The Helpful Fox, Senko-San",8.4,224,Aceptado por la critica
80,63174,US,en,Lucifer,"La serie se centrará en Lucifer (Tom Ellis) quien, aburrido e infeliz como el Señor del Infierno, dimite de su trono y abandona su reino para trasladarse a la ciudad de Los Angeles y abrir un lujoso piano-bar llamado Lux. Una vez allí ayudará a la policía a castigar a los más peligrosos criminales de la ciudad.",85.8739,2016-01-25,Lucifer,8.434,15439,Aceptado por la critica
35,154825,KR,ko,사내맞선,"Ha-ri se hace pasar por su amiga durante una cita a ciegas para ahuyentar al pretendiente. Pero el plan cambia cuando este resulta ser su CEO, que le hace una propuesta.",18.6784,2022-02-28,Propuesta laboral,8.429,736,Aceptado por la critica
16,62602,JP,ja,アオハライド,"Futaba Yoshioka tiene algunas razones por las que quiere “reiniciar” su imagen y su vida como una nueva estudiante de bachillerato. Futaba fue condenada al ostracismo por sus amigas en la secundaria por ser muy linda y, debido a un malentendido, no pudo transmitir sus sentimientos a quien le gustaba y que fue el único chico que no mostró interés en ella, Kou Tanaka. Ahora en bachillerato, está decidida a ser tan poco femenina como sea posible para que sus amigas no sientan celos de ella. Mientras se desarrolla su nueva vida, tendrá un encuentro importante en su vida y llegarán a sus oídos ciertas palabras de la persona que nunca imaginó.",9.9584,2014-07-08,Ao Haru Ride,8.433,344,Aceptado por la critica
9648,226529,KR,ko,조명가게,"Cada noche, la tienda de luces ilumina el callejón oscuro y da la bienvenida a clientes misteriosos.",8.3492,2024-12-04,Light Shop,8.4,243,Aceptado por la critica
18,100088,US,en,The Last of Us,"Año 2023, veinte años después del comienzo de una plaga mundial que infectó a población con un hongo mutado transformando a las personas en unas criaturas caníbales, el contrabandista Joel tiene la misión de escoltar a la adolescente Ellie por un mundo postapocalíptico en el nada va a ser fácil para los viajeros.  Joel todavía vive atormentado por el recuerdo de su única hija. Ellie es portadora de algo que podría cambiar el destino de la humanidad ¿Conseguirán sobrevivir los dos?",39.456,2023-01-15,The Last of Us,8.431,6988,Aceptado por la critica
16,62273,JP,ja,食戟のソーマ,"Shokugeki no Soma se centra en la vida de Soma Yukihira, un estudiante de secundaria con el sueño de superar las habilidades culinarias de su padre. Un día, su padre decide cerrar el restaurante de la familia para marcharse a pulir sus habilidades en el extranjero. Antes de irse, inscribe a Soma en una escuela culinaria muy prestigiosa, de la cual menos del 10 % de sus estudiantes consigue graduarse. ¿Estará Soma a la altura de la escuela?",11.8748,2015-04-04,Shokugeki no Soma,8.43,816,Aceptado por la critica
18,127529,KR,ko,사냥개들,Dos jóvenes boxeadores se alían con un prestamista benévolo para acabar con un despiadado usurero que se aprovecha de los más endeudados... y desesperados.,63.1516,2023-06-09,Perros de caza,8.43,677,Aceptado por la critica
16,35894,JP,ja,金色のガッシュベル!!,"La serie manga “Zatch Bell” está basada en los dibujos creados  por Makato Raiku. El personaje que da nombre a la serie es un ""mamodo""  –o ser de otra dimensión- que ha llegado a la Tierra junto a otros  99, para luchar entre sí hasta que sólo quede uno vivo, y se convierta  en Rey de los mamodos.

Una vez cada 100 años se produce la batalla por saber quién es el  nuevo Rey de los mamodos. Y ahora ha llegado el momento de que 100 de sus hijos  vayan a la Tierra con su libro de conjuros. El motivo por el que vienen a la Tierra  a luchar entre sí es porque sólo algunos humanos pueden leer ese  libro de conjuros. Por lo que se convierten en guardianes del libro. Cada mamodo  deberá encontrar al humano que pueda leer su libro, y cuanto antes.

Kyo es un brillante estudiante de 14 años que se siente fuera de lugar  en su instituto. Su padre, un importante hombre de negocios, regresa de Inglaterra,  donde ha estado por motivos de trabajo. Llega con un niño pequeño  que se hace llamar Zatch. Su padre lo ha encontrado en un jardín y parece  que el muchacho ha perdido la memoria y sólo lleva consigo un libro de  color rojo con extraños caracteres. Cuando Kyo abre el libro sorprende  a todo el mundo leyendo en voz alta uno de los caracteres que hay en su interior.  Esto hace que el pequeño Zatch sonría, ya ha descubierto al ser  humano que se va a convertir en el guardián de su libro. A partir de ahora,  los dos deberán luchar contra otros mamodos y sus guardianes, hasta que  sólo quede uno. Ése será quien se convierta en el Rey. En  esa lucha Kyo y Zatch tendrán que enfrentarse a otros mamodos, no todos  ellos malos.",17.3787,2003-04-06,Zatch Bell,8.427,262,Aceptado por la critica
16,90937,JP,ja,BEASTARS,"En un mundo donde conviven bestias de todo tipo, los instintos carnívoros de un amable lobo despiertan mientras su instituto debe lidiar con un asesinato.",34.9805,2019-10-10,Beastars,8.425,1286,Aceptado por la critica
16,66078,JP,ja,双星の陰陽師,"Rokuro procede de una familia de exorcistas, aunque preferiría ser futbolista, cantante o cualquier otra cosa antes que exorcista. Sin embargo la llegada de una chica llamada Benio despierta su espíritu competitivo y decide aprovechar su potencial como exorcista. Al final, al trabajar juntos se ganan el título de “Exorcistas de las Estrellas Gemelas”, y estarán destinados a casarse para tener un hijo que será el guerrero espiritual definitivo.",15.9901,2016-04-06,Sousei no Onmyouji,8.4,361,Aceptado por la critica
16,61752,JP,ja,ヘルシング アルティメット,"Se centra alrededor de la Orden de Caballeros Protestantes Reales, que son los últimos miembros descendientes de Abraham Van Hellsing. Su misión es la de proteger a la reina y las fronteras del país de toda amenaza sobrenatural. La organización está liderada por Sir Integra Fairbrook Wingates Hellsing, que heredó su responsabilidad como directora después de la muerte de su padre, cuando tenía 12 años. Bajo su mandato están Walter C. Dornez, y Alucard, un poderoso vampiro que fue capturado por la familia hace cien años. Más tarde se une también la ex-policía Seras Victoria, que tras ser mordida por Alucard se convierte en soldado de Hellsing.",11.8745,2006-02-10,Hellsing Ultimate,8.4,708,Aceptado por la critica
10759,37585,JP,ja,史上最強の弟子ケンイチ,"Kenichi Shirahama es un estudiante sin mucha popularidad ni amigos, todos le tratan como un cobarde y todos Ios días es sometido por los abusadores de su escuela. Un día conoce a Miu Furingi y descubre que es una luchadora excelente de artes marciales. Aquí comienza la aventura d Kenichi, para hacerse el discipulo mas fuerte y luchar contra Ias bandas de matones de su cuidad.",23.8249,2006-10-07,Shijou Saikyou no Deshi Kenichi,8.41,469,Aceptado por la critica
80,70523,DE,de,Dark,"Tras la desaparición de un niño, cuatro familias desesperadas tratan de entender lo ocurrido a medida que van desvelando un retorcido misterio que abarca tres décadas.",40.708,2017-12-01,Dark,8.423,7533,Aceptado por la critica
